,score,review
1062,0.5924807190895081,"Well I have to admit this was one of my favorites as a kid, when I used to watch it on a home projector as a super-8 reel. Now there isn't much to recommend it, other than the inherent camp value of a"
2991,0.5928789973258972,"Shiri Appleby is the cutest little embodiment of evil turned good girl demon-kicking Buffy clone, Elle. But I'm getting ahead of myself, you see Lilith was the first woman made by god as a companion t"
37,0.5950883030891418,"I waited for this movie to play in great anticipation. Assuming it would be more accurately portrayed like the movie, ""The Christmas Box"" based on the book by Richard Paul Evans. I sent out many email"
21,0.5968824625015259,"Grieving couple move to a cabin on a mountain after the loss of their daughter, discovering that there may be ghosts haunting the place, restless spirits of past occupants who committed suicide. Julie"
2004,0.5970472097396851,"1937's ""Stella Dallas"" with Barbara Stanwyck hasn't exactly aged well--how anyone thought a semi-updated version of the story would work now is a real puzzler. Perhaps they thought jaunty, cheerfully "
1695,0.5980101227760315,"I have grown up with Scooby doo all my life, My dad grew up with scooby doo. We have just watched the first episode of the travesty that calls itself Shaggy and Scooby get a clue. What planet are Warn"
2174,0.5991265773773193,The subject matter seems pretty dated today. Adapted for TV from Rona Jaffe's book; we trip and stumble through a fantasy existence. Four college students get deeply involved playing a live version of
2146,0.6010300517082214,A young couple Mandy Pullman (Mitch Martin) and Roy Seeley (Matt Birman) are relaxing on a beach in the small town of Galen. They decide to start playing practical jokes on each other. Mandy hides in 
744,0.6017752289772034,"Jennifer Cassi (Gina Philips from ""Dead and Breakfast"") returns back to the house she grew up in which she recently inherited from her deceased sister, unbeknownst to her grandmother (Fay Dunaway) who"
2712,0.602705717086792,"I thought Harvey Keitel, a young, fresh from the Sex Pistols John Lydon, then as a bonus, the music by Ennio Morricone. I expected an old-school, edgy, Italian cop thriller that was made in America. I"
1494,0.6028949022293091,"There is a bit of a spoiler below, which could ruin the surprise of the ONE unexpected and truly funny scene in this film. There is also information about the first film in this series.<br /><br />I c"
936,0.6039819121360779,"A spaceship returns from Mars; about a couple of months earlier, a 4-person expedition had been sent to the red planet. Most of the picture is a flashback to what transpired over there. The picture is"
2048,0.6040535569190979,"A couple of farmers struggle in life in a small village in China. Wang Lung (Paul Muni) buys O-Lan, his future wife, who becomes his slave (Luis Rainer). American stars appear in the leading roles, ta"
2053,0.6069779396057129,"It seems to me that Stephen King's ""Bachman"" pen-name was a way for him to put out some of the grimmer, rawer, more mean-spirited stuff that he wanted to write without 'contaminating' his 'brand name'"
282,0.6082335710525513,The film began with Wheeler sneaking into the apartment of his girlfriend. Her aunt (Edna May Oliver--a person too talented for this film) didn't like Wheeler--a sentiment I can easily relate to. The 
562,0.6088467240333557,Nothing to say but Wow! Has anyone actually had somebody sneak up on them in an open field? Well this happens about 25 times in this movie(clearly the directors' favorite scare tactic). In one of the 
1878,0.6090335845947266,"'Blue Desert' may have had the potential to be even a half-way plausible and more enjoyable thriller had the main character, Lisa Roberts (Courtney Cox) not been so stupid. When she is the victim of a"
1452,0.609625518321991,"In theory, films should be a form of entertainment. While this excludes documentaries and other experimental forms of film-making; most movies, specially genre films, must not only tell it's story or "
1316,0.6099334955215454,"I saw this recently and I must say, I was moved by the factual basis of the story. However, ""Holly"" as a movie did not quite work. I am however, looking forward to watching the documentary which the p"
230,0.612064778804779,Amy Heckerling's second film Johnny Dangerously is a parody of 1930's gangster films made in the Warner Brothers' tradition. Michael Keaton stars as a middle aged gangster looking back at his life of 
142,0.6148996353149414,This time the hero from the first film has become human and this time uses fist and foot combos against super universal soldiers and a computer which has gone awry and is prepared to take over the wor
1893,0.615815281867981,"Basically, take the concept of every Asian horror ghost movie and smash it into one and you get this movie. The story goes like this: a bunch of college kids get voice mails from their own phones that"
1953,0.6164323091506958,"Roy Rogers stars as Jesse James and his look-alike, gambler man Clint Burns. George ""Gabby"" Hayes is Mr. Rogers's ex-pal, Sheriff Gabby. Gale Storm (Jane Fillmore) and Sally Payne (Polly Morgan) are a"
1163,0.6185470819473267,"When I saw this at a shop I thought it looked really good and original. Like Wolfs Creek meets Texas chainsaw massacre, and I mean it only cost three quid (around $6). To be honest I don't think it wa"
1147,0.6188291907310486,"First of all, as a long time student of the Titanic disaster and member of several Titanic clubs, I feel entitled to comment on the film. I don't really care how many awards and accolades the film won"
2568,0.6196504831314087,"I give this marriage 3 years and thats stretching it. Adrianne Curry is fouled mouth, spoiled, controlling, loud, and her bi sexual past makes me laugh. She tells Chris he has an image to protect and "
1417,0.6197237372398376,"This kind of ""inspirational"" saccharine is enough to make you sick. It telegraphs its sentiments like the biggest semaphore on earth. It removes from the audience its own interpretation and feeling by"
2307,0.6198565363883972,"* Some spoilers *<br /><br />This movie is sometimes subtitled ""Life Everlasting."" That's often taken as reference to the final scene, but more accurately describes how dead and buried this once-estim"
20,0.6206490993499756,"Forbidden Siren is based upon the Siren 2 Playstation 2 (so many 2s) game. Like most video game turned movies, I would say the majority don't translate into a different medium really well. And that go"
2682,0.6214728951454163,Listening to the director's commentary confirmed what I had suspected whilst watching the film: this is a movie made by a guy who wants to play at making a movie. The plot is the kind of thing that de
2545,0.6219643354415894,"I really can't say anything bad *or* good about this thing. Its characters are likable enough, it's capably produced and designed, and professional-looking (except for that cheesy monster suit). Howev"
558,0.6220881342887878,"I was at first disgusted with director Sun-Woo Jang because I had felt that he cheated me. Jang had the potential to create a strong, deeply emotional film about sex and its effects on people, but ins"
2769,0.6228509545326233,"""Everything a great documentary could be""?? Yeah, if one is deaf, dumb, and blind. Everything but meaning, wit, visual style, and interesting subject matter. Aside from that. . .<br /><br />Seriously,"
1350,0.6229186058044434,"Teamo Supremo are three kids, consisting of their leader- Captain Crandall, Rope Girl and Skate Lad, all with their own battlecry (buza! chika! woopa!) and outfit and moves. They work for the governor"
594,0.6232996582984924,"Most college students find themselves lost in the bubble of academia, cut off from the communities in which they study and live. Their conversations are held with their fellow students and the college"
1064,0.6240341663360596,"Realistic movie,sure,except for the fact that the characters don't look like to be scared. When Billy Zane tries to kill someone, he feels bad...but he doesn't look like to. That's why I don't like hi"
1114,0.6240822076797485,"In its depiction of a miserable Milanese underclass, this film was probably quite revealing in its day. However, I get the feeling that neorealism was never really director De Sica's bag, since here h"
64,0.6247973442077637,I caught this Cuban film at at an arthouse film club. It was shown shortly after the magisterial 1935 Silly Symphony cartoon where the Isle of Symphony is reconciled with the Isle of Jazz. What with t
1231,0.6256005167961121,"""House Of Evil"" aka ""Dance Of Death"" of 1968 is the first of four infamous and odd last movies starring the great Boris Karloff and directed by Jack Hill and Juan Ibánez. Unlike ""Snake People"" (1971),"
946,0.6259228587150574,"In one respect, it's like 'The Wizard of Oz,' with Paris in black-and-white and the Riviera in color. But it's supposedly about possessive love, destructiveness and moral decadence, while actually bei"
2651,0.6259748339653015,There will be a time where kids will have grown up without ever seeing the one and only Bugs Bunny kiss (technically) another man on the lips. There will be a time where it won't be Duck or Rabbit sea
2435,0.6266759634017944,Andy Lau stars in another cop undercover tale. Daniel Wu plays Nick who is working for the cops and is also close to the top of a drug dealing gang(Lau). The movie begins as we watch the police try to
848,0.6272481679916382,"I have yet to read Shirley Jackson's novel, something of which I've been meaning to do for quite sometime. I am sure it has got to be scarier than this film. I remember jumping once when I watched it "
475,0.6277958154678345,"""Triumph of Love"" is proof that not every Comédie-Française author who uses cross-dressing disguised courtship like Shakespeare is worth seeing. <br /><br />Or maybe something was lost in the translat"
2906,0.6290568709373474,Omen IV: The Awakening starts at the 'St. Frances Orphanage' where husband & wife Karen (Faye Grant) & Gene York (Michael Woods) are given a baby girl by Sister Yvonne (Megan Leitch) who they have ado
517,0.629593551158905,First of all let me say that I had to think a lot about writing a comment for this movie. The best review for this kind of Cinema can be just the silence. Movie addressed to housewives and to grandmot
596,0.6296370625495911,The Tooth Fairy is set in a small town somewhere in Northern California where Peter Campbell (Lochlyn Munro) has brought a farming property which he is renovating & planning to turn into a holiday inn
2424,0.6311567425727844,"Terminus Paradis was exceptional, but ""Niki ardelean"" comes too late. We already have enough of this and we want something new.<br /><br />Big directors should have no problems seeing beyond their tim"
833,0.6311571598052979,"Terminus Paradis was exceptional, but ""Niki ardelean"" comes too late. We already have enough of this and we want something new.<br /><br />Big directors should have no problems seeing beyond their tim"
154,0.6338444948196411,"Some films that you pick up for a pound turn out to be rather good - 23rd Century films released dozens of obscure Italian and American movie that were great, but although Hardgore released some Fulci"
1973,0.6340377330780029,"There is one really good scene in Faat Kine. The title character gets in an argument with another woman and after being threatened, Faat Kine sprays her in the face. The scene works because the act is"
2430,0.6344012022018433,I had suspicions the movie was going to be bad. I'm a Duke's fan from way back. Have three years of the TV series on DVD. Well I was right. Took the family to see it. I really wanted to see the Genera
657,0.634569525718689,"For those who'd like to see this movie? I'd say: go! Without the narration it might be a very good movie/documentary. But the music, the narration and some of the implemented story lines make it very "
310,0.6355036497116089,I don't see how anyone who even likes Van Damne could like this movie.<br /><br />The movie actually starts out with some promise. I would say the action scenes at the beginning of the movie is excell
668,0.6361716985702515,OK..... This is the third in the series of carnosaur. Lets star with the dinosaur puppets! In the start of the film you cant See the Dino's cause when the body count starts you can only See the Dino's
577,0.6366437673568726,"Everyone in this movie tells Raffy Carruthers how talented she is, what a great director she'll one day turn out to be, etc. I think they're just being nice. Even Kimble Rendall, who directed this fil"
360,0.637283980846405,there was some truth to this movie. I remember a story reported 15 to 20 years ago of 4 fisherman finding a body in the water and they chose not to report it until their trip was finished. I also reca
2710,0.6391462087631226,"One of those Thank-God-I-don't-live-there documentaries. This one tells of two warring factions in Colombia, guerrillas and paramilitaries, and the surrounding peoples of Medellin.<br /><br />Guns, dr"
943,0.6395756602287292,A young boy sees his mother getting killed and his father hanging himself. 20 years later he gets a bunch of friends together to perform an exorcism on himself so he won't turn out like his father. Al
107,0.6396626830101013,"i should qualify that title, now that i think about it. Checkout is not entirely worthless. i've had the opportunity to see it twice, and on the second time i did get a great laugh at the movie's expe"
1171,0.6400812864303589,A movie about Vixen (Erica Gavin) who has a Mountie husband who she loves...but she loves sex too! In the course of the movie she gets multiple men in bed--including her husband AND brother! Also ther
2989,0.6405631899833679,"A movie has rarely left me as cold as this one. There is not a bit of tension, not a second of fear, not a moment we jump, even a little bit. The girl is cute, yeah. That's it. Was that worth a movie "
262,0.6414716243743896,"This is one of the two postapocalyptic fantasy movies that Albert Pyun made in 1993 - and it's the bad one. Apparently all his energy went into ""Nemesis"" which was an entertaining non-stop action movi"
620,0.642139732837677,"To overcome the death of his wife, an old man does what anyone in his position would naturally do (at least in a Peter Greenaway movie): he and his son populate their home with eight and a half (one h"
2618,0.6422362923622131,"The ENTIRE MOVIE is flashbacks from the first Boogeyman movie as well as, inexplicably, footage from another Uli Lommel / Suzanna Love film Brainwaves. It is framed with some more current (from the ea"
1215,0.6422605514526367,Any person with fairly good knowledge of German cinema will surely tell that numerous films about a young girl having troubles with her mother as well as her boy friend have been made in the past.If s
959,0.6423231363296509,"When the film started the first 4 minutes seemed like a travelogue of California, I was wondering if I got the tapes mixed up. Then I breathed a sigh of relief to see Paul Thomas in a scene with the l"
1028,0.643683910369873,"I've never been impressed by JD anyway, and Final Justice (which I hadn't seen prior to its MST3k airing) proves to be no exception. It's not that the character is any less likeable than Mitchell: it'"
1457,0.6472828984260559,"Everyone does things that they later regret. Things that they wish they could blame on drugs or alien possession. Things that although seem rational at the time, later reveal themselves to be engraved"
1692,0.6474629640579224,"I remember rather enjoying this a few years back but coming to it again, I wonder why. I guess it always looks good and the girls do rather well but the men do rather let the side down. Why oh why in "
1539,0.6477809548377991,"This reboot is like a processed McDonald's meal compared to Ang Lee's very good but very underrated 2003 ""The Incredible Hulk"".<br /><br />Ang Lee's ""The Hulk"" is a comic book movie for the thinking p"
416,0.6479800939559937,"One of the most peculiar oft-used romance movie plots is this one: A seriously messed-up man falls in love with a terminally ill woman, who turns his life around before dying. Occasionally this story "
2599,0.6484485864639282,"A remake of Alejandro Amenabar's Abre los Ojos, but this time with a living, breathing mask as a lead. For the dubious advantage of an English sound track, we endure Tom Cruise's soulless performance,"
1233,0.6501315832138062,"Disney has now made straight-to-video sequels to a good bunch of their many animated features. Two of these were made for their 1991 classic, ""Beauty and the Beast"". Well, these ones aren't really seq"
2999,0.6508457660675049,"The name ""cult movie"" is often given to films which continue to be screened, or to sell in home movie format, more than a generation after they were first released. Superchick, which was first release"
150,0.6509940028190613,Disappearance is set in the Mojave desert as Jim (Harry Hamlin) & Patty Henley (Susan Dey) plus their two kids Katie (Basia A'Hern) & Matt (Jeremey Lelliott) along with Ethan (Jamie Croft) a friend of
911,0.6515383720397949,"I watched this movie last night on one of the pay-per-view channels, and while watching it I quickly wondered why I bothered. In all honesty I really did expect something more from this film. Maybe so"
1536,0.6524172425270081,"Curiously, it is Rene Russo's eyes and mouth--not Buddy the Gorilla's-- that emerge as the focal point of ""Buddy"", a Jim Henson Pictures production through Francis Ford Coppola's Zoetrope. Somehow, co"
3015,0.6527934074401855,The tenuous connection between this film and the first Grease is established right at the beginning of the film when Didi Conn one of four cast members repeating their roles approaches young Maxwell C
1094,0.6530336141586304,(r#97)<br /><br />There is one good thing about this poor man's Pokémon (make of that what you will): the opening theme. It has to be the coolest theme music of any sloppily dubbed Japanese made-for-t
1183,0.6537867784500122,"Reasons to watch the movie:<br /><br />1) Bo Derek at 16 looks good and occasionally gets naked. She does a pretty good job playing an immature, insecure 16 year old beauty, in fact<br /><br />2) Many"
275,0.6559467315673828,"Soldier Blue is a movie with pretensions: pretensions to be some sort of profound statement on man's inhumanity to man, on the white man's exploitation of and brutality towards indigenous peoples; a b"
2543,0.6567191481590271,"Johnathan Frakes is a good actor and, when he's not directing a family film, a fine director. But, he really shouldn't have directed this movie, and the screenplay should've been rejected. The directo"
2958,0.6573973894119263,"As an avid fan of Cary Grant, I expected to watch this movie and howl with laughter, as AMC billed it as a comedy. I have never been more disappointed with a film! Cary's usual charm and effortless co"
1736,0.6578953266143799,"here, let me wave my hands over the keyboard, i'll tell you what salad she's going to order. over and over, works like a charm: he's such a genius, omg how does he do it? my bullshit detector freaks i"
931,0.6583326458930969,"I rented this on DVD and I kind of feel bad since Dawson and Lugacy are so earnest about it in the DVD comments. It's not a bad movie exactly, but it's one of those films that desperately wants to be "
397,0.6584583520889282,"W. Somerset Maugham's Of Human Bondage is supposed to be a English language classic. If so, much must have been missing from the film version here. Phillip's (Leslie Howard) attraction to Mildred (Bet"
583,0.6587504148483276,"It's easy to see how this below-average screenplay got by in the early sales-pitch meetings at Regency Films (and later with Fox): cross the superhero genre with a comedic take on ""Fatal Attraction"".."
2776,0.6595408320426941,"Perhaps I'm not a sophisticate. This and Closer are two of the more supposedly cerebral films I've seen recently, and both suffer from exactly the same problem to an excruciating extent. The dialogue "
2279,0.6597224473953247,"This is the story of a young woman seduced and then dumped by her older, married lover after she gets pregnant; she avenges herself against him, and his entire family, through black magic  which, dis"
2490,0.6613845825195312,I thought I was going to watch a scary movie.. and ended up laughing all the way throughout the movie. In the scene where the human transformed to a werewolf I thought they was kidding. Todays compute
1644,0.6618547439575195,Seriously. I just wrapped up my first viewing of Demonicus and words have failed me.<br /><br />I remember a time when I would see Charles Band's name on a film and my heart would race. He was never a
254,0.6619210243225098,Dooohhh! My Bwainn Hurrrts! Well it certainly does after this endurance test of a film. How on earth I managed to keep going without hitting the fast forward button lord only knows. <br /><br />Maybe 
2159,0.6620473861694336,"Scarecrows is one of those films that, with a little more acting, a little more direction, and a lot more story logic, would have been quite compelling as a horror entry. As it stands, it is still a c"
2668,0.6660487651824951,Remakes (and sequels) have been a staple of Cinema from the beginning of the media. It is pretty much a hit or miss venture though. If you take what's good of the original and build upon it and update
2334,0.6669907569885254,"I love Zombie-Movies and I love amateur-productions. And Meat Market 2 starts really promising with a nice homage to Fulci´s Classic ""Zombi"".<br /><br />So I leaned back and waited to be impressed. Ok"
806,0.6672362089157104,"As far as the movie goes, it's an OK science fiction movie. It has a lot of cool stuff in it, and some quality scenes. That said, it's not that good, and some of the stuff is pretty far fetched...<br "
401,0.6676591634750366,"Julia (Kristina Copeland) travels with her husband Steven Harris (Steven Man) and their baby son Alex to spend a couple of days with her family in Savage Island, an island of their own. The couple exp"
2822,0.6690405607223511,i should love this movie . the acting is very good and Barbara Stanwyck is great but the the movie has always seemed very trite to me . the movie makes working class people look low and cheap .the fac
180,0.6690462827682495,"What was this about ?? Pre-destination, you can not change the future cause it has already been written ??<br /><br />I'll give it this much. I did want to see what happened next and therefore watched"
334,0.6691662073135376,"...is the only way to describe this movie about subjects that should be surefire: scandal, sex, celebrity, power. Kirsten Dunst grins her way through her role as silent movie star Marion Davies like s"
2669,0.6695849895477295,"America needs the best man possible to win ""The game"" so who do they hire? A gymnast (Oh brother!) played by Kurt Thomas who has the necessary skills to win in a game which involves ninjas, a village "
3081,0.669710099697113,I think this would have been a much better film if the Cajuns had been portrayed in a more believable light. My family is from the southeast region of Louisiana and I live in southeast Texas (about 20
2925,0.6702078580856323,"Dolph Lundgren stars as a former cop/boxer who searches Boston's kinky scene to find out who killed his brother,who was well thought of in the community, however along the way he learns how his brothe"
1229,0.670684814453125,"I will admit that I have seen maybe five minutes of ""Jerry Springer"". I don't consider myself a snob, but I really think that I am above watching what's on his show. You should try to elevate yourself"
997,0.6716614961624146,"I stole this movie when I was a freshmen in college. I've tried to watch it three times, the second two because friends wanted to see it. ""Sweet, Adam Sandler, I've never heard of this movie, but sinc"
1009,0.6722772121429443,"Beverly garland was born in the wrong time. She was an actress ahead of her time, bringing power and grace to even such lame flicks as the Corman films she starred in. In Gunslinger, she's the town sh"
2196,0.673181414604187,"You may want to know up front that I am not a Mormon, unlike a good number of those who have already reviewed this film. I mention this so you'll understand that the way I look at the film may differ "
449,0.6735356450080872,"This movie really shows its age. The print I saw was terrible due to age, but it is possible that there are better prints out there. However, this was not the major problem with the movie. The problem"
2160,0.6738206744194031,"<br /><br />Back in his youth, the old man had wanted to marry his first cousin, but his family forbid it. Many decades later, the old man has raised three children (two boys and one girl), and allows"
398,0.6738206744194031,"<br /><br />Back in his youth, the old man had wanted to marry his first cousin, but his family forbid it. Many decades later, the old man has raised three children (two boys and one girl), and allows"
2974,0.6741223931312561,"The Last Station, director Michael Hoffman's melodrama about the last months in the life of Leo Tolstoy, begins with fog and sleep. Tolstoy (Christopher Plummer) lives with his family in a compound at"
1683,0.6742703914642334,"Okay. So there aren't really that many great movies around. Recent gems like American Dream, The Straight Story and even Toy Story 2 don't normally come so close together. But boy (!) does this film c"
585,0.6753596067428589,"In Texas, seven friends meet in a bar to celebrate the Halloween night before going to a party. Meanwhile, they call the American Nightmare pirate radio for fun and confess their innermost fears. A se"
