,score,review
2551,1.670647382736206,"This film describes the experiences of a couple of hit men (one of them Burt Reynolds), a prostitute, and two drag queens over the interval of a few hours on one night in Miami. The convergent storyli"
1357,1.6711198091506958,"You know, I went to see ""The Hills have eyes 2"" wanting to like it. I really enjoyed the original, and the remake was fairly entertaining. They obviously had more money to throw around than Wes Craven"
2794,1.6749600172042847,"Ok, first of all, I am a huge zombie movie fan. I loved all of Romero's flicks and thoroughly enjoyed the re-make of Dawn of the Dead. So when I had heard every single critic railing this movie I was "
704,1.6760902404785156,OK when I saw the previews for this movie I thought it looked really scary and was quite excited to see it as were the group I was with. Now living in America especially during this election I see som
2729,1.676162600517273,"I saw this recently on a faded old VHS tape, and remembered it dimly. Looking at it now, it seems charming.<br /><br />When it was first released, it was recognized by pretty much everyone as a spoof "
2921,1.6764590740203857,"I read somewhere where this film was supposed to be a remake of the 1949 film noir, ""Criss Cross."" I found the latter to be disappointing but it was still better than this film. <br /><br />This movie"
818,1.6775290966033936,"Back in the 70's, when I had first seen this, I was in high school. It was cool then. Now as an adult I look back at it and I say to myself..yeah right. What was so funny? It has it's moments but they"
1260,1.678412914276123,54 is a film about a club with that very title in the setting of the 70s era. It features the classic good-looking bartender. The sexy females. The high powered owner. The partying. When all entwined 
2469,1.6788525581359863,There is a uk edition to this show which is rather less extravagant than the US version. The person concerned will get a new kitchen or perhaps bedroom and bathroom and is wonderfully grateful for wha
979,1.6801064014434814,"I just couldn't stop laughing!! This movie is incredibly funny and stupid! But, never mind that, it is very entertaining! In this film, you don't need to pay attention to anything! The acting is the s"
2313,1.6804285049438477,"I wonder who, how and more importantly why the decision to call Richard Attenborough to direct the most singular sensation to hit Broadway in many many years? He's an Academy Award winning director. Y"
1455,1.6805827617645264,"If you hit your teens in the 70s, as I did, you probably remember the stories about Studio 54 whether or not you liked disco. An exclusive club, it was the perfect symbol of 70s cultural overindulgenc"
3064,1.6806741952896118,"Who in their right mind plays a lyrical song at the same time they are portraying an emotional scene between two people? When Flipper confronts his wronged wife in the dressing room, the song sung wit"
1868,1.6812490224838257,"For the first forty minutes, Empire really shapes itself up: it appears to be a strong, confident, and relatively unknown gangster flick. At the time I didn't know why, I thought it was good- but now "
957,1.6841825246810913,This movie proves that you can't judge a movie by the awesome artwork on the DVD cover. It also goes to show that you should learn more about a movie before you buy it (or get it for someone at Christ
2278,1.68616783618927,The genre of suspense films really takes a dive in this one. The big problem is IMPLAUSABILITY. I realize that you need to create difficult situations which would cause suspense and the tense feeling 
1208,1.686511754989624,"Many moons ago when I was seven years old, I can vaguely remember seeing a trailer for this movie. It appealed to my naive sense of curiosity and I decided to ask my parents to take me to this movie. "
2945,1.6869827508926392,"May I start off by saying that Casey Affleck is a very talented actor and I respect his work very much. I wish he was in more movies that showcased his talent. With this said, Soul Survivors was a ver"
134,1.6877472400665283,"The story of a woman (Ann) on her death bed, her two daughters (Nina and Constance) and her thoughts about her past. The flashbacks are concerning a weekend where young Ann is in the wedding of her fr"
2228,1.6882447004318237,"I love killer Insects movies they are great fun to watch, I had to watch this movie as it was one of my Favourite horror books by Shaun Hutson.<br /><br />I have met him and I wish I did listen to him"
909,1.6887589693069458,"Sam (Thomas Cavanagh) and Gray (Heather Graham) are devoted siblings who share an apartment and a love of many things -- ballroom dancing, 1940s movie musicals and, much to their surprise, an attracti"
887,1.6892081499099731,"I will warn you here: I chose to believe those reviewers who said that this wasn't an action film in the usual sense, rather a psychological drama so you should appreciate it on that basis and you wil"
469,1.6894816160202026,"This film is the freshman effort of Stephanie Beaton and her new production company. While it suffers from a few problems, as every low budget production does, it is a good start for Ms. Beaton and he"
867,1.6904182434082031,"I heard so much about this movie how it was a great slasher and one of those early 80's movies that die hard fans of most slasher movies just had to see. Well, I rented it and I have to say that altho"
2724,1.6907844543457031,"I used to be an avid viewer until I personally spent long cold hours helping build a home for the White Family, only to be sickened to see the house a year later. All of the beautiful rock landscaping"
1380,1.691247582435608,"Why do movie makers always go against the author's work? I mean, yes, things have to be condensed for the sake of viewer interest, but look at Anne of Green Gables. They did a wonderful job of combini"
1840,1.6924347877502441,I read the book a long time back and don't specifically remember the plot but do remember that I enjoyed it. Since I'm home sick on the couch it seemed like a good idea and Hey !! It is a Lifetime mov
2871,1.6925048828125,"It's always tough having a sibling doing better in their life than you, always a struggle to get out from under that shadow and not let bitterness keep you away from your family. So, imagine that your"
1527,1.6925643682479858,"This documentary begins with an interesting premise -- it makes an intriguing and convincing argument that the history of Jesus as is commonly believed is probably a myth. Sadly, though, after priming"
2931,1.694474458694458,"I like Brad Pitt enormously. He is an actor with brains and wit, not to mention face, pectorals and all the rest. Since I saw him in ""Thelma and Louise"" a thought has been bothering me, who does he re"
880,1.6966544389724731,"*Spoilers and extreme bashing lay ahead*<br /><br />When this show first started, I found it tolerable and fun. Fairly Oddparents was the kind of cartoon that kids and adults liked. It also had high r"
1437,1.6975980997085571,"Dietrich Bonhoeffer's writings have had a profound influence on my life as a Christian, and I eagerly anticipated watching this movie and finding out more about his life. Words can hardly express my d"
1871,1.700995922088623,"I just came from seeing this movie and decided to see what others thought of it. I'm left wondering if these people who give glowing reviews saw the same film! This is potentially a very good story, b"
2971,1.7010550498962402,"I felt this movie started out well. The acting was spot on and I felt for all the characters situation, even though the true family unit was not completely revealed. We never got enough info on the fa"
573,1.7024610042572021,"Others have already commented on the ""decline"" of director Tobe Hooper, but what about Brad Dourif? He was perfectly capable of selecting good projects (as he proved by starring in the same year's ""Ex"
1898,1.7027854919433594,"Welcome to Our Town, welcome to your town? As we are introduced into the worlds of its townsfolk of 1901 America, this three act play is opened before us with the help of ""The Stage Manager"", a visual"
473,1.7033145427703857,"MONSTER - He was great; I loved the special-effects which created this monster which looked like an updated version of ""The Creature From the Black Lagoon."" The scenes with this beast roaming the land"
14,1.703756332397461,"Well well well. As good as John Carpenter's season 1 outing in ""Masters of Horror"" was, this is the complete opposite. He certainly proved he was still a master of horror with ""Cigarette Burns"" but ""P"
2979,1.7041271924972534,"""A trio of treasure hunters is searching the West Indies for a hidden fortune. The lure of gold makes for a rise in tension as the men come closer to the treasure's location. The deep-sea divers hope "
2944,1.704360008239746,"I watched Phat Beach on cable for a while and I sort of enjoyed it. The fat guy is the best character, as he seems to be a nice guy. The rest of the characters are just various stereotypes of young me"
2420,1.704521656036377,"In director Sooraj Barjatya's Vivah,20-something Delhi boy Shahid Kapur finds himself smitten by the demure, small-town girl his father has selected for him to marry. Drawn to her innocence and simpli"
1081,1.7047992944717407,"The film is based on a genuine 1950s novel.<br /><br />Journalist Colin McInnes wrote a set of three ""London novels"": ""Absolute Beginners"", ""City of Spades"" and ""Mr Love and Justice"". I have read all "
865,1.7071813344955444,"This is a well made informative film in the vein of PBS Frontline. The problem is, Frontline already did this piece and managed to bring L. Paul Bremer in to tell his side of the story. More troubling"
581,1.7082889080047607,"I am a great fan of David Lynch and have everything that he's made on DVD except for Hotel Room & the 2 hour Twin Peaks movie. So, when I found out about this, I immediately grabbed it and...and...wha"
202,1.7088121175765991,A hard to find film which coasts on the still pervasive mythology of Senator Joe McCarthy as a political demon king. Boyle (as Joe) gives a compelling but historically inaccurate portrayal of the Wisc
1408,1.7088401317596436,"Irwin Allen was great. All of his TV shows had a great pilot, or first episode. the rest were basically rip offs of his other shows. A few episodes of Swiss Family Robinson were rip offs of his older "
387,1.7095407247543335,"To anyone not familiar with c.S. Forrester's book this film should be interesting. It is colorful, well acted and depicts high adventure, but to those of us who know the original stories it is appalli"
2150,1.7098006010055542,"Serge Farnel made a very precise critics of this film in the revue ""The Rwandese night"" (www.lanuitrwandaise.net)<br /><br />A critics which shows how France was behind all the situation undergone by "
2467,1.7110581398010254,"This film was screen as part of the 2007 Sydney Mardi Gras Film Festival. I had no expectation of the film as someone else choose it for me.<br /><br />I actually like films that take time to develop,"
2024,1.711859107017517,"I've seen this movie today for the first time and I never heard of it before, probably because of it's poor message. <br /><br />First of all, the directing itself is quite good, the actors played wel"
2173,1.7123652696609497,"I used to have a fascination with the cartoon back in college when it was being made. It had much the charm of ""Get Smart"". While it admittedly had its faults, it was rather enjoyable.<br /><br />Natu"
2819,1.7129155397415161,"This movie is about a very sexy Olympic track star who is hired to coach a high school boys' basketball team. Similar to Goldie Hawn's WILDCATS, it stars Cathy Lee Crosby in the title role, and she do"
2656,1.7159571647644043,"This is the first time I ever saw a movie with Jamie Foxx, and I bet it will be my last. I failed to see why he was funny, although people in the audience thought it was very funny when he made a face"
605,1.7161110639572144,This documentary is a reenactment of the last few years of Betty Page's(Paige Richards) career. The Tennessee tease was the most recognizable pin-up queen in history. Her most memorable work came in t
3000,1.7163097858428955,"My flatmate rented out this film the other night, so we watched it together.<br /><br />The first impression is actually a positive one, because the whole movie is shot in this colorful, grainy, post-"
2328,1.7171454429626465,"I saw this ""hot"" movie when it came out in 1986. It had a X rating for a brief scene involving oral sex but played in mainstream theatres (it was an ""art"" film). Supposedly it's the first film to ever"
1959,1.7175477743148804,First some background; I am English and have lived in London all my life. I have been to many games at 'The Den' and most other London club grounds. I am familiar with the type of person who gets into
2994,1.7175861597061157,"""A Gentleman's Game"" uses the game of golf in a country club setting to illustrate an adolescent's discovery about honesty, prejudice, and other life lessons. Several times I thought I knew where this"
1477,1.7188868522644043,"I have been waiting for this movie a long time. Especially because Juhi Chawla is in this, she's a great actress.<br /><br />This movie contains six stories. It's a new concept flew over from Hollywoo"
431,1.7189217805862427,"The performances of Fishbourne (who appears strangely funny somehow) and (short featured)Ed Harris are remarkable, unlike Connery's who doesn't appear to find sense in his role and ends up in the moto"
503,1.719887375831604,I saw this film in its premier week in 1975. I was 13 years old and at that time I found it adequate and somewhat fun. I then came to discover the WORLD of Doc Savage through the Bantam novels of the 
2379,1.720976710319519,"There is something in most of us, especially guys, that admires some really working class small town ""real men"" populist fare. And Sean Penn serves it up for us with a cherry on top. Hey, A lot of peo"
2504,1.7210674285888672,"Living in the Middle East (in Israel), I was excited when I bought my ticket for Syriana. Having seen the trailer, and being a thriller-lover, I expected to see first of all a fast moving, breath catc"
2134,1.7216767072677612,"I'm glad I rented this movie for one reason: its shortcomings made me want to read Allende's book and get the full story. <br /><br />Pros: the movie is beautiful, the period is depicted well and cons"
1334,1.7220911979675293,"Detective Tony Rome (Frank Sinatra) returns to the screen after his self titled debut, this time it's a film that's played for ermlaughs. While on a diving trip, Rome finds the body of a blonde beaut"
326,1.722306728363037,"The day has finally come for me to witness the perpetuation of Azumi's fate as an assassin, fruition of her character and the ultimate attempt to draw me deeper into the world she rampaged through so "
368,1.7236735820770264,Cannon pulled off a real visual beauty of a medieval epic that appears fascinating (except for the dragon prop). Now just how did the long-gone studio known for Chuck Norris movies ever come up with a
1036,1.7267413139343262,"I've never found Charley Chase very funny, even though his on-screen character sometimes reminds me of John Cleese, whom I find VERY funny. (Charley Chase also reminds me of gowky Hen Broon from Scotl"
2022,1.727007508277893,As a Turkish man now living in Sweden I must confess I often watch Scandinavian movies. Most if them I never understand. I think actors from Scandinavia work best in Hollywood. Last week I watched a f
1032,1.7280373573303223,"i read the book ""7 years in Tibet"" from Heinrich Harrer and was fascinated of it. then i immediately grabbed the DVD and started to watch the movie. i remember the first time i saw it back in 98, i ki"
161,1.732258915901184,"This film was the recipient of the 1990 Academy award for Best Animated Short Film. Over the last few weeks, I have seen dozens of the nominees and recipients of this award from the last 30 years and "
1617,1.732260823249817,"I go to UCSB and take some classes with the executive producer, Alison Anders. She's a superb teacher and director so anything she put her name on, I thought must be pretty good. This film as a select"
122,1.732323169708252,"Allow me to start this review by saying this: I love vampire movies. They can suck (har har pun intended), and I'll still love them because vampires are just cool in movies. Van Helsing, considered by"
79,1.7356306314468384,This film concerns the story of Eddy as mentioned in the title and his homecoming to old friends in a seaside community. The plot involves the group of friends as it comes to light that Eddy left as a
588,1.7368532419204712,"I am a huge, huge fan of John Cusack, Samuel L. Jackson, and Tony Shalhoub. I'm slightly less fond of Stephen King, but I like some of his work.<br /><br />This said, I should have LOVED 1408.<br /><b"
514,1.7384401559829712,"The author of numerous novels, plays, and short stories, W. Somerset Maugham (1874-1965) was considered among the world's great authors during his lifetime, and although his reputation has faded over "
519,1.7387330532073975,R Balki tries to tell you a story that had been earlier told by Ram Gopal Verma in Nishabd in a sensuous way. This time it is mixed with mature humors.<br /><br />Amitabh Bachchan is a Chef and owns a
1053,1.7408546209335327,"There's plenty to appreciate here: spectacular locations and flying sequences; period costumes, props and sets; and competent writing and acting. However, to enjoy a drama, we need at least one princi"
217,1.743861436843872,"There is a key aspect of film that Jobson seems to have forgotten - it has the ability to tell a story by showing it to you. You don't need to tell the audience what to think, because they'll see it. "
2082,1.7440184354782104,The TV guide calls this movie a mystery. What is a mystery to me is how is it possible that a culture that can produce such intricate and complex classical music and brilliant mathematicians cannot pr
2636,1.7445311546325684,"(This is a review of the later English release by Disney, featuring Alison Lohman, Patrick Stewart, and co.) <br /><br />I really wanted this film to be good. Really, really. I'm a huge fan of Princes"
346,1.7449365854263306,"Cult of the Cobra is now available on DVD in a pristine print that does full justice to whatever merits it has as a movie. Unfortunately, that is not saying much.<br /><br />It has a competent cast of"
1345,1.7453886270523071,"I didn't really expect much from ""The Night Listener"" and I actually never heard of it until I saw the cover in the videostore. However, the movie is very effective when it comes to building up suspen"
528,1.7455486059188843,"Having been forced by my children to watch this at least 10 times for each of the last 2 Christmases, I feel adequately qualified to pass judgment on this version of Dr. Seuss' classic tale, and well."
1310,1.7481728792190552,"Let me start out by saying i will try not to put too many spoilers in this. Normally I enjoy Robin Williams movies, however this gem was not one of them. It was billed as a suspenseful thriller. The n"
1162,1.7482926845550537,"Six for the price of one! So it is a bonanza time for Cinegoers. Isn't it? Here it is not one, not two but all SIX-love stories, an ensemble cast of top stars of bollywood, plus all stories in the gen"
243,1.7492148876190186,"One night I was waiting for my friends to come back to the apt and ""Gymkata"" happened to be on; I watched way too much of it. It is indeed hilarious, and horrifying, really. Think about it this way--i"
1975,1.749322533607483,"(Only minor spoilers except as noted).<br /><br />I've enjoyed a lot of Spanish cinema recently; both the actual Spanish cinema of people like Almodovar, and the Latin American cinema of directors lik"
1804,1.7526873350143433,"I loved the original. It was brilliant and always will be. Strangely though, I actually looked forward to seeing the re-make. I'm usually a little bit against re-makes because there's far too many of "
1982,1.7544499635696411,"My grandmother took me and my sister out to see this movie when it came out in theaters back in 1998, and so we happily bought the tickets, the popcorn and soda, and walked right in to the theater and"
2417,1.754490852355957,"Les Visiteurs, the first movie about the medieval time travelers was actually funny. I like Jean Reno as an actor, but there was more. There were unexpected twists, funny situations and of course plai"
864,1.754490852355957,"Les Visiteurs, the first movie about the medieval time travelers was actually funny. I like Jean Reno as an actor, but there was more. There were unexpected twists, funny situations and of course plai"
1106,1.7546184062957764,"When you have two tower house of performers pitched against each other, the least you can expect is the superb camaraderie and that is the case in this film where we have a 64 yrs old Amitabh Bachchan"
2606,1.755008578300476,In the glory days of the 90s (god rest its soul) you could turn on the great Comedy Central at any hour of the day and see the greatest sketch comedy show of all time Saturday Night Live. Whpat a glor
656,1.7556864023208618,"Cafe Lumiere is a beautifully photographed nullity. Unacquainted with the work of the director, I am well-acquainted with the filmmaker he is supposedly paying tribute to - Ozu Yasujiro. While not eve"
2589,1.7558542490005493,"Carl Panzram lived an amazing life and scribbled down his memoirs on scraps of paper for possibly the only person who ever did anything selfless for him. The book ""Panzram: A Journal of Murder"" by Tho"
2447,1.7563934326171875,"Even though there's a repertoire of over 180 films to choose from, this 'Succubus' is often named as THE best Jess Franco film. Heck, even the legendary filmmaker Fritz Lang counts 'Succubus' among hi"
2393,1.75686514377594,"'Ninteen Eighty-Four' is a film about a futuristic society in which the government controls everything and no one can be trusted. It is a very dark film, and it is one that will not make you feel good"
2859,1.7570312023162842,"As we all know Hollywood enjoys changing historical events around for our enjoyment, and 44 minutes is one of those hollywoodized movies. For example the bank robbers never did go back in the bank whe"
248,1.7573024034500122,"Honestly I can't understand why this movie rates so well here, nor why Bakshi himself thought it was his finest film. I'm a huge fan of Bakshi's earlier work - particularly 'Heavy Traffic' and 'Wizard"
1128,1.7591757774353027,"On the face of it, Ruiz has set out to make a psychological thriller. Although it's not as satisfying as a classic piece in that genre, there are compensations. The tensions generated between Huppert "
265,1.7602993249893188,"When HEY ARNOLD! first came on the air in 1996, I watched it. It was one of my favorite shows. Then the same episodes started getting shown over and over again so I got tired of waiting for new episod"
2310,1.7604526281356812,"I firstly and completely and confidently disagree with the user who calls this a ""spoof"". Crispin Glover is very serious about his film. He personally introduced the film at the screening I saw in Chi"
2880,1.7610535621643066,"We all have seen some unending epics in our times, but this one really tops them all! The movie is so long and so slow, that, just to put things in perspective, i felt a lot older when i left movie ha"
956,1.7624144554138184,I am not sure why I like Dolph Lundgren. I guess seeing him on screen makes me feel that anyone who works hard can succeed regardless of talent. That is a good feeling for all of us who lack talent. S
1113,1.7638767957687378,"Me and a group of friends rent horrible videos to laugh at them, trust me it has lead to some horribly spent money but also some great laughs. S.I.C.K. is one of the better horror-but-funny movie we'v"
3041,1.7648545503616333,Once upon a time in the mid 1990s I used to write for DOCTOR WHO fanzines and the whole of fandom was holding its breathe about the new American produced DOCTOR WHO TVM . As soon as it was announced t
1335,1.7655327320098877,"Clocking in at an interminable three hours and twenty minutes, ""Salaam-e-Ishq"" is a pretty but superficial comic soap opera from India that regales us with six interwoven tales of romantic love (which"
1607,1.768125057220459,"I never much liked the Myra movie, tho I appreciate how it pushed the Hollywood envelope at the time. Certainly Miss Welch's costume became an iconic image, though I have to wonder if many people who "
1123,1.7694095373153687,"I love horror movies that brings out a real amount of mystery like say ""silent hill"" ( which i found to be quite good, but still, was missing something ) and movies that keeps you guessing, this i tho"
934,1.7700934410095215,This is a case of a bunch of people thinking they are so clever they have a story that fits the time. Remember the all-around political conspiracies caught on camera in the years leading to the Waterg
1752,1.7703124284744263,he was my hero for all time until he went along with {if you can call it a movie} I went to the show to watch it and come out and not just asking for me money back but asked for double the money thats
1100,1.7706354856491089,"Are you familiar with concept of children's artwork? While it is not the greatest Picasso any three-year-old has ever accomplished with their fingers, you encourage them to do more. If painting is wha"
284,1.7719660997390747,"My first review of 2010 is ""Into The Blue 2: The Reef"". The story is about two divers played by Chris Carmack and Laura Vandervoort who love to explore hidden treasures at a bottom of a local reef. On"
