,score,review
1379,0.0001229839981533587,"One of the most common entries in the 'goofs' category is anachronism. Though I'm beginning to believe that anachronism and other goofs are more acceptable, even ignored, in very good films, but are f"
2397,0.0005105686723254621,"What was an exciting and fairly original series by Fox has degraded down to meandering tripe. During the first season, Dark Angel was on my weekly ""must see"" list, and not just because of Jessica Alba"
1709,0.0005105686723254621,"What was an exciting and fairly original series by Fox has degraded down to meandering tripe. During the first season, Dark Angel was on my weekly ""must see"" list, and not just because of Jessica Alba"
840,0.0015193030703812838,"If this guy can make a movie, then I sure as hell can make one too.<br /><br />In fact, if you hire me to make a movie for you, I promise to do the following:<br /><br />1) I will add more naked women"
2875,0.0017946765292435884,"""I thought I'd be locked away in a padded cell and they'd throw away the key"" (Thus is a paraphrased snatch of dialogue from ""State of Mind"".<br /><br />One wonders in what tangled forest Paula Milne "
330,0.00413545360788703,"After spotting the high rating on IMDb, I decided to go see this movie. Beyond that high rating, I intentionally avoided reading any of the reviews. I wanted to go into the theater with a clean slate,"
422,0.004418156109750271,"Loony Tunes have ventured (at least) twice into the future. The first time was with the brilliantly funny ""Duck Dodgers"". The latter time was with this  um  effort. ""Loonatics Unleashed"" isn't witho"
1427,0.004587716422975063,"In 1967, mine workers find the remnants of an ancient vanished civilization named Abkani that believe there are the worlds of light and darkness. When they opened the gate between these worlds ten tho"
2390,0.0066498746164143085,I really looked forward to this program for two reasons; I really liked Jan Michael Vincent and I am an aviation nut and have a serious love affair with helicopters. I don't like this program because 
1519,0.006986052729189396,"I had some expectation for the movie, since it had a nice star cast and it is the return of the duo of Akshay and Saif. Well, I was hesitant to watch the movie because this was done by the same man wh"
2391,0.007598385214805603,"I truly wish I was not writing this review. I'm a Christian, so I waited anxiously to see this movie. It seemed great -- a Christian movie with some fairly famous stars and a plot that seemed intrigui"
1547,0.008300775662064552,"Oh, well, this movie starts off well. It's kinda funny and seems like it could be a fun movie. Then it becomes a bit serious and goes off the rails. It sort of wants to be 'Boogie Nights' but it can't"
1338,0.009902829304337502,"Anyone who's watched a few Lifetime Movie Network movies knows that plot credibility is the first thing that gets brushed off the planning table. So, when crazed Lara moves into Patti's home and metho"
1696,0.010014698840677738,An unmarried woman named Stella (Bette Midler) gets pregnant by a wealthy man (Stephen Collins). He offers to marry her out of a sense of obligation but she turns him down flat and decides to raise th
1706,0.010101167485117912,Hail Bollywood and men Directors !<br /><br />Really this is the ultimate limit in utter sacrifice made by Indian Woman !!<br /><br />Viewing the current state of affairs in India where The wives are 
521,0.010419978760182858,"Henry, a veterinarian (Paul Rudd), and his bossy fiancé, Kate (Eva Longoria) are looking over the last minute arrangements for their reception. It is the morning of their wedding and Kate is in a fren"
460,0.010525979101657867,"note to George Litman, and others: the Mystery Science Theater 3000 riff is ""I don't think so, *breeder*"".<br /><br />my favorite riff is ""Why were you looking at his 'like'?"", simply for the complete"
622,0.010637021623551846,"The film begins with people on Earth discovering that their rocket to Mars had not been lost but was just drifting out in Space near out planet. When it's retrieved, one of the crew members is ill, on"
1546,0.010711108334362507,"Definitely an odd debut for Michael Madsen. Madsen plays Cecil Moe, an alcoholic family man whose life is crumbling all around him. Cecil grabs a phone book, looks up the name of a preacher, and calls"
1166,0.011470269411802292,"When Marlene Dietrich was labeled box office poison in 1938 one of a handful of actresses so named by the trades papers, it was films like The Garden Of Allah. How a film could be so breathtakingly be"
1020,0.01212644949555397,"Well where to start here? Straightheads presents me with a bit of a dilemma. Had this film come out of Italy in, say, 1975, been directed by Ruggero Deodatto and starred David Hess, then I'd be lappin"
2028,0.012884947471320629,"I think i watched this movie, but don't quote me, as i may have fallen asleep during watching it as it didn't exactly ""grip my excitement and imagination."" At least i know i watched enough of it to kn"
2908,0.013166312128305435,It's obvious that all of the good reviews posted for this movie so far are from insiders who were either involved with the film or who know somebody who knows somebody and have thus seen multiple cuts
2893,0.013276836834847927,"""The Return of Chandu"" is notable, if one can say that, for the casting of Bela Lugosi as the hero rather than the villain. Why he even gets the girl.<br /><br /> The story as such, involves the Black"
183,0.014750598929822445,"It's common practice for a film about repression to be somewhat muted in style and tone. There's a difference, however, between using restraint and encouraging narcolepsy among audience members. In ""T"
2229,0.015930021181702614,"There are similarities between Ray Lawrence's ""Jindabyne"" and his last movie ""Lantana""  a dead body and its repercussions for already dysfunctional lives. But whereas ""Lantana"" offered some hope and "
999,0.017220336943864822,"Not that I was really surprised....movies are never as good as the books that they originated from. I was looking forward to seeing this movie because this is one of my favorite books, even though I k"
2857,0.018011219799518585,"This film actually works from a fairly original idea - I've never seen nymphs that were thrown out of heaven in a horror movie before anyway. However, the way that it executes this idea isn't original"
1274,0.021701449528336525,Former brat pack actor and all round pretty boy Rob Lowe stars in a film set in a high security American prison . I had a gut feeling his character was going to be popular for all the wrong reasons li
870,0.022183261811733246,"The TV guide described the plot of SEVERED TIES as thus : "" An experiment on a severed arm goes awry "" so right away I thought this was going to be about an arm that`s got a mind of its own as seen in"
1757,0.022205768153071404,"When converting a book to film, it is generally a good idea to keep at least some of the author's intended tone or conveyed concepts, rather than ignoring the author altogether. While it is clear that"
778,0.02261461317539215,"There's been a vogue for the past few years for often-as-not ironic zombie-related films, as well as other media incarnations of the flesh- eating resurrected dead. ""Fido"" is a film that's either an a"
2981,0.023652203381061554,"In my humble opinion, this version of the great BDWY musical has only two things going for it - Tyne Daly and the fact that there is now a filmed version with the original script. (OK Vanessa Williams"
526,0.024344082921743393,"Well...tremors I, the original started off in 1990 and i found the movie quite enjoyable to watch. however, they proceeded to make tremors II and III. Trust me, those movies started going downhill rig"
1526,0.02522449381649494,This is not a film you can really analyse separately from it's production. The audience became the film-makers to an extent unprecedented in the history of the American film industry; we felt so invol
2864,0.026362892240285873,"This 1973 TV remake of the Billy Wilder classic is inferior to the original. Surprise!<br /><br />First, the good things. Lee J. Cobb makes a terrific Barton Keyes. He's not as good as Edward G. Robin"
1514,0.026783412322402,I'm a huge fan of Ivan Reitman-I loved Evolution and who didn't like Ghostbusters? From the trailer you already know that Uma's character will get dumped by Luke's.So the build-up is obviously towards
1927,0.027361517772078514,"This Italian movie is basically a soap opera with skin.<br /><br />The VHS box said it was rated ""R"" but the into on the actual tape inside said it was ""X."" The latter makes a lot more sense because t"
534,0.027644172310829163,"Live Feed is set in some unnamed Chinese/Japanese Asian district somewhere as five American friends, Sarah (Ashley Schappert), Emily (Taayla Markell), Linda (Caroline Chojnacki), Mike (Lee Tichon) & D"
1328,0.029968831688165665,"Hunters chase what they think is a man through the forest, though the audience sees he is a werewolf. The hunters never seem to realize this, because after they shoot him, he looks normal when they de"
3008,0.03083469159901142,"The Flock is not really a movie. It's a wannabe movie, with wannabe actors. Not including Richard Gere, he gave an excellent performance, but when only one of the actors truly gives himself to his cha"
228,0.031520698219537735,"Whoever made this movie must have done it as a joke. I mean, this was the stupidest movie I think I have ever seen!! A killer snowman terrorizes a small town? Give me a break. Love it when he takes of"
2824,0.0324493944644928,"To preface this review, I must say that I was, I suppose, a little curious about this movie.. However, I probably would not have seen it had I not had my arm slightly twisted.<br /><br />In my opinion"
2212,0.03433165326714516,"Film version of Sandra Bernhard's one-woman off-Broadway show is gaspingly pretentious. Sandra spoofs lounge acts and superstars, but her sense of irony is only fitfully interesting, and fitfully funn"
291,0.0367240309715271,1st watched 12/7/2002 - 3 out of 10(Dir-Steve Purcell): Typical Mary Kate & Ashley fare with a few more kisses. It looks to me like the girls are getting pretty tired of this stuff and it will be inte
1538,0.03843289613723755,"We see a body of dead girl in a morgue with the coroner trying to close the eyes of the girl, but whatever he tries they won't stay open. After this we move into the future and we follow a group of fo"
1218,0.039009470492601395,I read in the papers that W.Snipes was broke so no wonder he would take parts in low budget projects like The Contractor.He is just the next action star to join a growing club:the penniless action sta
2367,0.03926094248890877,"When I first tuned in on this morning news, I thought, ""wow, finally, some entertainment."" It was slightly amusing for a week or so... But we have to face it, these news reporters (if one can even cal"
2458,0.04088124260306358,Lets put it this way. I actually get this movie. I get what the writer/directer was trying to do. I understand that the dialog was meant to be dry and emotionless. I understand that the plot was suppo
807,0.04169106110930443,How many fricken' times do we have to see a spook walking by in the background & peaking through a mirror's reflection? It's been done in two dozen movies in recent memory & four dozen times in this c
2625,0.04276866093277931,"Superman II - The Richard Donner Cut should be a fan's dream come true. At long last, footage only seen in photos and scenes that only existed on the printed page would finally come to life. A directo"
2235,0.04306473955512047,"For most younger viewers out there, they probably have no idea who Buster Keaton was. So, because of this, they probably won't feel nearly as sad when watching this film as I did. I happen to be a sil"
11,0.04523616284132004,"The message of this movie is ""personality is more important than beauty"". Jeanine Garofalo is supposed to be the ""ugly duckling"", but the funny thing is that she's not at all ugly (actually she's a lo"
1326,0.045252248644828796,"I can't recommend this film as a date movie. Gary Oldman's semi-autobiographical account of life lived on a South East London estate is a violent, Beckettian account of one of Dante's circles of hell,"
2378,0.045425381511449814,"or anyone who was praying for the sight of Al Cliver wrestling a naked, 7ft tall black guy into a full nelson, your film has arrived! Film starlet Laura Crawford (Ursula Buchfellner) is kidnapped by a"
2556,0.04595448449254036,"You remember the Spice Girls movie and how bad it was (besides the songs), well their manager Simon Fuller (also this band's manager) makes the same error putting S Club (another of my favourite bands"
1844,0.04671226441860199,"When I noticed that ""Hamish Macbeth"" was being broadcast in the United States, I was thrilled. I then had the misfortune to watch the darn thing. I adore M. C. Beaton's books about the wonderful Scott"
2234,0.04805171862244606,"Who is Bettie Page? I certainly didn't find out while watching this movie. From what I have gathered from other sources, Ms. Page was highly in demand in the post-world war II period as the queen of """
871,0.04822143539786339,"When I look for new cars, I expect not to be shown boats. When I drink fountain Coke, I should expect that the drink contains Coke. When I watch a movie that embellishes itself with the name of en exc"
1605,0.05010516569018364,"In this movie, Chávez supporters (either venezuelan and not-venezuelan) just lie about a dramatic situation in our country. <br /><br />They did not say that the conflict started because of Chávez ann"
2666,0.0503736287355423,five minutes after watching this i logged on to IMDb to warn all of you out there not to bother with this movie... genre:horror? it had moments of mild suspense and throughout the whole movie i was th
1550,0.05059405043721199,"This movie portrays Ruth as a womanizing, hard drinking, gambling, overeating sports figure with a little baseball thrown in. Babe Ruths early life was quite interesting and this was for all intents a"
2954,0.05279260128736496,"There are plenty of comments already posted saying exactly how I felt about this film so Ill keep it short.<br /><br />""The Grinch"" I thought was marvellous - Jim Carrey is a truly talented, physical "
2111,0.053999125957489014,"""Back of Beyond"" takes place at a dive diner/gas station in the middle of the Australian desert run by Tom McGregor (Paul Mercurio), a shy guy who suddenly finds himself in a spot of trouble when some"
2223,0.054708752781152725,"I got this movie because I worked at a movie store so I got free rentals. It came in, and the cover made it look alright. Hot chick, carrying a weapon, alright, I'll check it out.<br /><br />Oh man, b"
3025,0.056382644921541214,"Generally over rated movie which boasts a strong cast and some clever dialog and of course Dean Martin songs. Problem is Nicholas Cage, there is no chemistry between he and Cher and they are the centr"
451,0.05901673063635826,"Some have praised -Atlantis:-The Lost Empire- as a Disney adventure for adults. I don't think so--at least not for thinking adults.<br /><br />This script suggests a beginning as a live-action movie, "
1489,0.0591248981654644,"Audrey, I know you truly cherish your husband Ted's memory but PLEASE do his legacy justice and heed his wishes. Dr. Seuss refused to license his characters during his lifetime for a very good reason."
813,0.060141608119010925,"Prior to this film, I had only seen two films by director Andrea Bianchi: the trashy zombie flick Le Notti del Terrore (1981), famous amongst horror fans for its unforgettable performance from man-chi"
1429,0.06037106737494469,"THAT'S certainly a strange way to promote a film upon which a great deal rested. And it seems like plain suicide on the part of the studio, given that (1) The feuds between the cast were well known lo"
1823,0.06104259192943573,"The motion picture was, in all likelihood, made in the year 1930 and released in 1931. I would surmise that talking motion pictures had great difficulty in making the transition from the silent era. N"
2303,0.061341896653175354,"I love the frequently misnomered ""Masters of Horror"" series. Horror fans live in a constant lack of nourishment. Projects like this (and the similar ""Greenlight Project"" with gave us ""Feast"" - like it"
2046,0.06151565536856651,It must be the most corniest TV show on the air. This is probably a escape for Jim Belushi and all of his bad movies. His brother sucked all the talent out he younger brother. I hope this show is canc
681,0.061958204954862595,"I actually saw this movie at a theater. As soon as I handed the cashier my money, she said two words I had never heard at a theater, before or since: ""No refunds!"" As soon as I heard those words, I sh"
518,0.06346206367015839,The first time I watched Cold Case was after it had run for about a year on Danish television. At the time it came to the TV it nearly drowned in 4 or 5 other American crime shows aired roughly the sa
1658,0.06361781060695648,"First of all, yes, animals have emotions. If you didn't know that already, then I believe you are a moron. But let's assume that none of us are morons. We all know that animals have emotions, and we n"
409,0.06421057879924774,Hybrid starts as water treatment planet security guard Aaron Scates (Cory Monteith) is involved in an accident which leaves him blind. Luckily it just so happens that brilliant scientist Dr. Andrea He
42,0.0646531879901886,"Early film directed by D.W. Griffith; it features a gloriously happy King (Arthur V. Johnson) and his Queen (Marion Leonard) - but, wait! When the King leaves the scene, his Queen makes music with the"
2170,0.06480854004621506,"Suggesting nothing less than a movie-length version of the 1970s TV hit ""Love, American Style,"" decked out with flashes of nudity, ""Superchick"" (1973) is a lighthearted piece of fluff that somehow sti"
340,0.06528015434741974,"OK, I kinda like the idea of this movie. I'm in the age demographic, and I kinda identify with some of the stories. Even the sometimes tacky and meaningless dialogue seems semi-realistic, and in a dif"
565,0.06713351607322693,This DVD appears to be targetted at someone who will just put it on and play it in an endless loop in the background. It's organized as a series of music videos of the Grand Canyon set to various piec
1367,0.06796451658010483,I rented I AM CURIOUS-YELLOW from my video store because of all the controversy that surrounded it when it was first released in 1967. I also heard that at first it was seized by U.S. customs if it ev
1821,0.06802035868167877,"Steven Seagal, Mr. Personality himself, this time is the United States' greatest Stealth pilot who is promised a pardon from the military(..who attempted to swipe his memory at the beginning of the mo"
3052,0.06822199374437332,"By all the fawning people have been doing over Miike and his work. I sat through this flick tonight. I figured, if it's half as good as Ringu, as I assumed from these comments it might be, than it wil"
901,0.06834995746612549,Kareena Kapoor in a bikini hmmmmmmmm.<br /><br />Akshay Kumar...<br /><br />Anil Kapoor....<br /><br />Maybe Saif....<br /><br />Kareena Kapoor in a bikini.....<br /><br />Good Banner..<br /><br />Kar
1144,0.06863679736852646,"After just 15 minutes into this film, I began to miss Zhang Yimou's earlier, more weighty films that looked at the politics and society of China from unique perspectives. His turn to martial arts film"
1196,0.06870389729738235,"You do realize that you've been watching the EXACT SAME SHOW for eight years, right? I could understand the initial curiosity of seeing strangers co-exist on an Island, but you'd think that after watc"
2841,0.06870389729738235,"You do realize that you've been watching the EXACT SAME SHOW for eight years, right? I could understand the initial curiosity of seeing strangers co-exist on an Island, but you'd think that after watc"
170,0.06870390474796295,"You do realize that you've been watching the EXACT SAME SHOW for eight years, right? I could understand the initial curiosity of seeing strangers co-exist on an Island, but you'd think that after watc"
2502,0.06942710280418396,"I hate to sound like an 'old person', but frankly I haven't seen too many movies that I like that were made after 1960... generally, movies just seem to get worse and worse (although I quite enjoyed t"
3003,0.07018035650253296,"I saw the film tonight at a free preview screening, and despite the fact that I didn't pay a dime to see this film I still felt ripped off. Ladies and gentlemen, time is money and if you see this film"
1431,0.07329080253839493,I came to NEW PORT SOUTH expecting a surrogate movie about the Columbine school massacre similar to Gus Van Sant's ELEPHANT and certainly the synopsis in the TV guide stating that a student sociopath 
1856,0.07350344955921173,"""A death at a college campus appears to be a suicide but is actually a cover for murder. The dead man's roommate finds himself embroiled in a mystery as he tries to uncover the truth behind the young "
1793,0.07388296723365784,"Recap: Full moon. A creature, a huge werewolf, is on the hunt. Not for flesh, not for blood (not that it seem to mind to take a bite on the way though), but for a mate. He is on the hunt for a girl. N"
2787,0.07468222081661224,"When Stanwyck's husband-to-be is murdered on the eve of their wedding, she retreats to a mountain lodge, where she slips (sort of) off a cliff and is rescued by wealthy attorney Morgan. Morgan falls i"
3085,0.07514636218547821,"I expected this to be a lot better. I love Tim Burton's work, so I was really excited to see these online short films. Well, they weren't at all what I had expected.<br /><br />I don't really know wha"
1119,0.07617761194705963,The five or so really good westerns that Mann made are unequaled as an ensemble in Hollywood. Even John Ford never made that many with so much quality. The curious thing about them all is how uneven t
1828,0.07674002647399902,"I will admit that I'm only a college student at this present time, an English major at that. At the time I saw this film I was a high school student--I want to say junior year but it may have been sen"
136,0.07818417996168137,There is no question as to who is in command of the training of cadets in this film: Major Chick Davis (Pat O'Brien). O'Brien plays an officer who adheres to military discipline in the creation of a n
2615,0.0788799449801445,"First of all, I firmly believe that Norwegian movies are continually getting better. From the tedious emotional films of the 70's and 80's, movies from this place actually started to contain a bit of "
789,0.07923881709575653,"Story of a man who has unnatural feelings for a pig. Starts out with a opening scene that is a terrific example of absurd comedy. A formal orchestra audience is turned into an insane, violent mob by t"
2128,0.08020899444818497,"Michael Bennett and Nicholas Dante's Broadway show ran for years, but evidence of its power and charisma is lost in this movie adaptation, which most likely stems from the choice of director (Richard "
1089,0.08132977038621902,"The first 45 minutes of Dragon Fighter are entirely acceptable and surprisingly watchable. The characters are believable and interesting. The cloning lab looks really high-tech. After that, it all col"
3045,0.08273284137248993,It is hard to describe this film and one wants to tried hard not to dismiss it too quickly because you have a feeling that this might just be the perfect film for some 12 years old girl...<br /><br />
739,0.08336695283651352,"Dolph Lundgren stars as a templar who comes to New York when a key that unlocks the anti-Christ is found by an archaeologist, of course the demon is only a couple miles behind Dolph and isn't killed s"
769,0.08388935029506683,"Just in time to capitalize on the long-awaited movie version of ""Dreamgirls"" is the DVD release of this semi-forgotten 1976 musical melodrama that also takes the rise of the Supremes as its inspiratio"
509,0.0848345011472702,Writer/Director Bart Sibrel bases his work here around a can of film that he says was mistakenly sent to him by NASA. He says it shows the astronauts faking the television footage of their trip to the
708,0.08497331291437149,"To quote the film, ""It's better not to know. Better still to forget. Best of all to be abandoned."" Oh, the irony.<br /><br />A ghost story with all the technical refinements of a Hollywood horror film"
1688,0.08549594134092331,"A few months ago, I was involved in a debate with another IMDb poster (Hey, Kmadden) about this film. The poster insisted that if I gave 'Flushed Away' a chance, I would like it. Based partially on th"
2366,0.0866425409913063,"I had the opportunity to preview this film as a member of a test audience, and the only thing which kept me in my seat was the chance to fill out the post-screening survey. I felt the film's biggest p"
2679,0.08706999570131302,"Generally, I've found that if you don't hear about a movie prior to seeing it on DVD, there's probably a good reason for it. I hadn't heard about this movie at all until I was in a Blockbuster the oth"
1139,0.08941467106342316,A very young Ginger Rogers trades quick quips and one liners with rival newspaper reporter Lyle Talbot in this 1933 murder mystery from Poverty Row film maker Allied Productions. The movie opens with 
290,0.09027817845344543,"For some reason, various young couples hiking through the Italian Alps split up to see who can reach their campsite designation first. James (Gregory Lee Kenyon) enters a cave, finds a skeleton of an "
