,score,review
2065,1.1325433254241943,"So the other night I decided to watch Tales from the Hollywood Hills: Natica Jackson. Or Power, Passion, Murder as it is called in Holland. When I bought the film I noticed that Michelle Pfeiffer was "
52,1.1328407526016235,"Sly Stallone is hardly the finest actor in the world but compared to his brother, Frank...well, roll out those awards now! Mullet haired, muppet Frank seems to think that every part he plays, calls fo"
760,1.1330667734146118,TYSON <br /><br />Aspect ratio: 1.33:1<br /><br />Sound format: Stereo<br /><br />Reverent - though scrupulously fair - account of the life and times of champion boxer Mike Tyson. Given his conviction
1663,1.133118748664856,"Lil Bush is a 30 minute cartoon show comprised of 2 15 minutes episodes shown on Comedy Central. It takes place in a fictional, cartoonish Washington D.C., and centers around the satirical, childish r"
351,1.1348077058792114,"In the third entry of the Phantasm series, Mike and Reggie continue chasing the Tall Man, assisted by a trigger-happy 9 year old, a black G.I. Jane and the spirit of Mike's deceased brother (he died i"
2740,1.1351797580718994,"""La Lupa Mannara"" aka. ""Werewolf Woman"" of 1976 is a film with a highly promising title, but, sadly, the film itself is pretty far away from being a must-see for my fellow Italian Horror buffs. You wo"
1060,1.1353191137313843,"The direction had clearly stated that this film's idea and plot is totally original....however, as to those who have read 'slam dunk' comic, we can clearly see that the characters are very similar and"
2295,1.1353867053985596,"It's hard to imagine that anyone could find this short their favorite if they have seen most of their shorts, but I know that humor is VERY subjective. I have seen all of their sound shorts (by far th"
1356,1.1359753608703613,"[I saw this movie once late on a public tv station, so I don't know if it's on video or not.]<br /><br />This is one of the ""Baby Burlesks"" (sic) that Shirley Temple did in the early 1930s. It is hard"
2722,1.135995626449585,"I'm no horror movie buff, but my wife's nieces and nephews are. So, I saw the first movie. It was gruesome, and tense, but not my taste. Still good though. For similar reasons, at this very moment, I "
356,1.1371111869812012,"Well, the artyfartyrati of Cannes may have liked this film but not me I am afraid. If you like the type of film where shots linger for so long that you wonder whether the actor has fallen asleep or th"
814,1.1376749277114868,"I watched Free Money last night & it was the longest 90+ minutes of my life. With such an intriguing cast, I really thought that I was in for a treat - especially since I'm a Brando fan. WRONG! What a"
2837,1.1379975080490112,"The first half hour or so of this movie I liked. The obvious budding romance between Ingrid Bergman and Mel Ferrer was cute to watch and I wanted to see the inevitable happen between them. However, on"
2309,1.1384639739990234,"This reworking of Anthony Shaffer's classic play did not last long in cinemas. Having recently suffered through it on cable, I still congratulate myself for not wasting money on a ticket. Director Ken"
358,1.1395719051361084,I never quite understood the popularity of Saban's Power Rangers show which was quite simply a second rate Americanized version of Japan's ultra popular super sentai series of the past three decades! 
1298,1.139589548110962,"Wow. Some movies just leave me speechless. This was undeniably one of those movies. When I left the theatre, not a single word came to my mouth. All I had was an incredible urge to slam my head agains"
2133,1.1404449939727783,"To grasp where this 1976 version of A STAR IS BORN is coming from consider this: Its final number is sung by Barbra Streisand in a seven minute and forty second close-up, followed by another two-and-h"
2222,1.1408066749572754,"Ever since I was eight years old I have been a big wrestling fan. It didn't matter what federation I watched. WWE,WCW,USWA. To me the action is all I watched it for.<br /><br />May 23rd 1999. That was"
710,1.1409664154052734,"Snow White, which just came out in Locarno, where I had the chance to see it, of course refers to the world famous fairy tale. And it also refers to coke. In the end, real snow of the Swiss Alps plays"
1606,1.1415036916732788,"Since the 70s, writer/producer/director Charles Band has been responsible for literally hundreds of science-fiction, fantasy and horror B-movies. Some of them are wonderful examples of how to use a ti"
211,1.1419857740402222,"This really should deserve a ""O"" rating, or even a negative ten. I watched this show for ages, and the show jumped the shark around series 7. This episode, however, is proof that the show has jumped t"
2911,1.1440151929855347,"On the surface, ""Show Me The Money"" should have at least finished a full season. You had the always entertaining William Shatner as your host, surrounded by a baker's dozen of beautiful leggy models c"
2199,1.1440337896347046,"Like some of the other folks who have reviewed this film, I was also waxing nostalgic about it...before I had the misfortune to actually watch it again. Alas, my childhood memories of this film were c"
843,1.1451168060302734,"Scary, but mostly in the sense that will it be over before I turn 70. I saw this as a late night re-run in about 1976 and thought it would never end. Like crackers, it's better than nothing (but just)"
2402,1.1453841924667358,"After seeing the trailer of this film in the cinema, i thought that it was an original concept for a thriller, setting it in the competitive world of computer companies. The all star cast was another "
2846,1.1478354930877686,I was really looking forward to this show given the quality of the actors and the fact that The Scott brothers were involved. Unfortunately my hopes were dashed! Yet again we are led to believe that t
1055,1.1485050916671753,"Really, the use of stock nature documentary of swarming bats employed by THE BAT PEOPLE is some of the most effective ever. There are shots of teeming bats hanging from the ceilings of caves, swarming"
2616,1.1488173007965088,"Don't understand how these animated movies keep coming out, and no matter how good (or bad) it is people love it.<br /><br />I saw this movie with my two kids (5,7). They like pretty much anything ani"
113,1.1508468389511108,"""John Hughes' son wrote a high school drama! Wow!"" I thought as I checked the flick's info here on IMDb, late on a Saturday night, having found myself watching the opening credits on BBC2.<br /><br />"
1635,1.1526135206222534,"This is the official sequel to the '92 sci-fi action thriller. In the original, Van Damme was among several dead Vietnam War vets revived to be the perfect soldiers (Unisols). In this one, it's, I gue"
1839,1.1532601118087769,I can't believe that the City of Muncie is so hard up for attention that they would embarrass themselves by allowing this show to be done there. This show is like a slap in the face to real hard worki
1059,1.1550101041793823,"It's funny. I've seen a bunch of Fassbinder films and I have found some to be extremely creative and interesting, while others are repellent and self-indulgent messes--like this film. For me, it range"
1228,1.155029058456421,*** REVIEW MAY CONTAIN SOME SPOILERS *** I'll make this review short and sweet. I bought this movie from Best Buy because it sounded interested and had some top actors in it like Kevin Spacey and Morg
932,1.1553057432174683,I think its time for Seagal to go quietly into the night. What I have just seen makes all his direct to video releases in the last few years look like his early 90's smash hits in comparison.<br /><br
1406,1.1556633710861206,"Well, I'd be lying if I said that this could easily rival Spiderman or the Batman movies. Still, it was more appealing to me for it's moral value. I first bought the VHS when my son was about 2 years "
1987,1.156076192855835,"My first full Heston movie. The movie that everyone already knows the ending to. A ""Sci Fi Thriller"". The campy factor. Everything that goes with this movie was injected in my head when I rented it, a"
378,1.1572011709213257,"I agree with the previous comment, the beginning of the movie is quite good, and get's you wandering about what is to come....... Which is nothing. All open story lines remain open; two characters who"
1770,1.1573796272277832,"War, Inc. - Corporations take over war in the future and use a lone assassin Brand Hauser (John Cusack) to do their wet-work against rival CEOs. A dark comedy satirizing the military and corporations "
2273,1.1589218378067017,"Stan Laurel and Oliver Hardy had extensive (separate) film careers before they were eventually teamed. For many of Ollie's pre-Stan films, he was billed on screen as Babe Hardy ... and throughout his "
1430,1.1598273515701294,"This Italian film from the '70's is NOT even in the class with Dog Soldiers, The Howling, or even that awful American Werewolf in Paris, BUT...it is fun to watch. I'm talking about watching the lead a"
305,1.1605762243270874,"Jamie Foxx is my favorite comedian. However, I feel that he sold out in order to gain his first big budget lead role. Foxx follows in the footsteps of the likes of Chris Tucker, Martin Lawrence and Da"
1817,1.1608238220214844,"Three tales are told in this film, that seemed to have been shot without knowledge of this being a combined vignette film. The makers relate the three vignettes by having them all connected to shrink "
1974,1.1614794731140137,"This is one of those topics I can relate to a little more than most people as I hate noise & have no idea how those in big cities, New York especially how people get any sleep at all! It astounds me t"
2663,1.1615028381347656,"This early John Wayne Lone Star western has a bit more going for it than the run-of-the-mill oaters Wayne had been making for Lone Star up until that time. For one, it has his old friend Paul Fix in i"
705,1.161525011062622,"I saw this movie primarily to see Brooke Burke (as Jill), who I had meet briefly in LA at a modeling trade show, in her first feature film. I was hoping to see more of her, but thought she did very we"
1682,1.1617577075958252,"Hollywood always had trouble coming to terms with a ""religious picture."" Strange Cargo proves to be no exception. Although utilizing the talents of a superb cast, and produced on a top budget, with su"
1327,1.1630401611328125,"Left Behind is the kind of ""we know what we know cause we know it"" movie that Christians (and most any other naive person) needs to help them feel like what they ""THINK"" and ""BELIEVE"" (not ""KNOW"") is "
1341,1.1650238037109375,"I've seen my share of Woody Allen's movies, and while they're not always great, you can usually be sure you're going to be entertained. Probably the last really good ones were Bullets Over Broadway ('"
2062,1.1658107042312622,"There are a couple of prior comments here which opine about this flick's abundance of clichés throughout -- and I agree completely, both with regard to the characters AND the dialog.<br /><br />I'd re"
920,1.1660319566726685,"Every new fall line-up show deserves, at least, my ""3 strikes and you're out"" policy. I give a comedy 3 chances to make me laugh, that is, 3 complete episodes. After Episode 1, I actually said to the "
598,1.1664841175079346,"I was true to my regard for Mr. Glover and Ms. Goldberg. I watched the entire film with my family and some friends. I have no idea what the movie was about. After much discussion, we all agreed that t"
1462,1.1675057411193848,"BEGIN SPOILER: Fitfully funny and memorable for Mr. Chong's literal roach-smoking scene: Chong coolly mashes a stray kitchen cockroach into his pipe's bowl, lights up, coughs and hacks violently for a"
2951,1.169310212135315,The producers of this film offer to pay funeral expenses for anyone who dies of fright while watching this movie. They should have offered intensive psychotherapy for anyone who really enjoyed this st
670,1.1725800037384033,"I can't believe this show is still rating a 9 out of 10. I could see if those votes were in the first 2 seasons, but what would possess anyone to continue to rate it high after that? I was a huge fan "
2094,1.1735310554504395,"This was thought to be the flagship work of the open source community, something that would stand up and scream at the worlds media to take notice as we're not stuck in the marketing trap with our opt"
2833,1.1737666130065918,"Geez! This is one of those movies that you think you previously reviewed but you didn't. I mean, you didn't give a crap about it but somehow it came to your mind.<br /><br />To be honest and brief; th"
1581,1.1738895177841187,"an very good storyline, good thrill to it ... but the 10 last seconds destroyed the whole movie... what happened? extremely well made and an good story destroyed in the last seconds... sorry to say bu"
827,1.1740407943725586,"""White Noise"" had potential to be one of the most talked about movies since ""The Exorcist"" I think. Seeing as EVP is supposedly true it really had an easy passage to be a feared true fact. Not many mo"
728,1.1757909059524536,I discovered this movie with a retailer selling OOP's. And this one surely is an OOP. One year after The Exorcist she's back in business with this movie but what we all new was that the career of Blai
1390,1.1766794919967651,"Dave is going through a divorce and his mind wanders back to his first love. ""Wanders"" is probably not the word. I should say he fixates on the past girlfriend. He recalls to the day when the relation"
625,1.1767115592956543,"Paul Armstrong is a liberal, Scottish-born, professor of law at Harvard, known for his passionate opposition to the death penalty, who is hired to take on the case of Bobby Earl, a young black man fro"
129,1.177532434463501,"I commented on this when it first debuted and gave it a ""thumbs in the middle"" review, remarking that I'd give it the benefit of the doubt beyond just the first episode. I've seen a total of six episo"
227,1.1775561571121216,"Garson Kanin wrote and directed this look at ""modern day"" Las Vegas and the gap between generations, his first directorial effort since the 1940s! David Janssen is somewhat miscast as a big-shot casin"
1031,1.1787481307983398,"The fourth ""Tremors"" feature goes back in time, to the year 1889. ""The Legend Begins"" in the small city of ""Perfection"", which was then ""Rejection, Nevada"". As the story begins, seventeen miners are k"
2341,1.1794170141220093,"Okay. Look- I've seen LOTS and I do mean LOTS of these types of films. You know, the ones where the DVD cover just look SO good and scaarrryyy that you just cant WAIT to see it? Well, I got GOT again."
2946,1.1803710460662842,"Just recently, I've been obsessing over and anticipating this movie so much that I almost had to see it. Well, having just seen it today, the 5.8 rating is completely understandable. I think that if y"
1410,1.1814244985580444,Based on Tom Wolfe's satirical novel that was praised by all (i have not read it yet) Tom Hanks stars as a wall streeter who accidentally kills a black boy while lost in a bad part of NYC Willis stars
641,1.1814371347427368,"I'll admit that I don't expect much from a Roger Corman film. Generally, I expect a lot of walking and bad scripts. Yet in this case, I am pleasantly surprised.<br /><br />The Gunslinger is a story of"
1101,1.1816426515579224,"I give this movie 3 out of 10 because I have watched zillions of movies and I can tell clearly what an intellectual movie with a mind-teasing message should look like. Definitely, The Broken is not on"
3058,1.1824084520339966,"Take one look at the cover of this movie, and you know right away that you are not about to watch a landmark film. This is cheese filmmaking in every respect, but it does have its moments. Despite the"
2437,1.183053970336914,"I'm not a huge Star Trek fan, but I was looking forward to this. I was intrigued by the pre-hype descriptions of the Enterprise, its cramped-submarine styling and rough-edged technology compared to th"
2079,1.1846377849578857,"By the time this film was released I had seen Chorus Line on stage 4 times, and had been anticipating most eagerly the long-rumored production of a film of the story. My wife and I were in line hours "
2358,1.186632513999939,"I hadn't heard of this film until I read an article about it on the Unknown Movies website, which made me curious. As a cartoonist and illustrator myself, I'm an admirer of Richard Williams's work - I"
1853,1.1870430707931519,"I just saw this movie on Flix after timer-taping it. I grew up watching F Troop and had a major hard for Wrangler Jane so I was shocked, literally shocked, to find out after seeing this film that the "
830,1.1872459650039673,"I've heard about this movie for many years, and finally got a chance to see it. A massive murdering of cheerleaders back in 1963 and 1969 eventually cause a cheerleading camp to close up. Fast forward"
1774,1.1876375675201416,"My husband and I were intrigued by the spectacle - a strong willed Southern lady with a messy personal life solves crimes for the LAPD. The first season was must-see TV for us. Unfortunately, the stor"
315,1.187783122062683,"If there's one thing you can count on Disney to do, it's their uncanny ability to take a story and tell it again and again and again. Even watching the commercial for Lady and the Tramp II was a horri"
1066,1.1883689165115356,"I've now seen this film twice, and I must say I enjoyed it both times. It's fast paced and fun, but ultimately daft. Having said that it deserves to be trashed because of screwing up what could have b"
57,1.1889506578445435,"Stewart Moss stars as a scientist who is on a working trip with his wife, and one gets the feeling that he was picked for this role for his ability to roll his eyes back in his head...imagine the audi"
2898,1.1901570558547974,"Daddy's girls Florence Lawrence and Dorothy West receive some terrific news at the local post office, unaware they are being stalked by burglar Charles Inslee. Meanwhile, father David Miles receives a"
238,1.190714955329895,"It makes one wonder how this show is still on the air. There's been one couple that has stayed together, married, and has children, but everyone else has broken up. What's the point of continuing this"
1312,1.1913858652114868,"I saw Chan Is Missing when it first came out, about four years after moving from San Francisco to New York. Maybe it was the perspective of a few years away, but this movie seemed to capture the essen"
438,1.1916509866714478,"One wonders why anyone would try to rehash successful movie plots that have already been seen, like it's the case with this movie. ""The Wedding Date"" is one of the best examples of why not to even try"
967,1.1923227310180664,I first saw this movie when I was about 10 years old. My mom bought it at our local Kmart because it was on sale for $5 on VHS. She thought that it would be a nice Christmas movie for me and my brothe
1960,1.1926283836364746,"I usually read reviews before I watch a movie. Guess what, I didn't do that before watching TLB, and I have to say I was very surprised to see the above average rating at IMDb. I found it to have a to"
2103,1.192751169204712,"Ben Masters,(Kyd Thomas),""Dream Lover"",'86 plays a sort of Mike Hammer character, a private eye who does any old job for a buck and never misses out on all the sexy curves of good looking gals. Kyd ma"
3023,1.1935456991195679,"Genie (Zoe Trilling) arrives in Egypt to visit her hypocritical, bible-quoting archeologist father (William Finley) and attracts the attention of a group of cultists led by a descendant of the Marquis"
3072,1.1946513652801514,"The basic premise of ""Miami Golem"" most definitely deserves a spot in the top, say, fifty of most demented cinematic plots ever scripted down! I know top 50 doesn't sound too impressive, but I've seen"
1805,1.1953519582748413,This could be a cute movie for kids My grandson watched it once. he was watching it a second time I was watching some of it with him.<br /><br />When the little bear gets lost on the ice burg and he i
1906,1.1967344284057617,"This might be unbelievable, but this movie has grossed $878,138 in Russia! It's shown in almost all cinema theaters and still running! Well, I have no idea why distributors put their eye on this parti"
1659,1.1971440315246582,"Office work, especially in this era of computers, multi-functional copy machines, e-mail, voice mail, snail mail and `temps,' is territory ripe with satirical possibilities, a vein previously tapped i"
1765,1.1972908973693848,"I was browsing through Netflix and stumbled upon this movie. Having fond memories of the book as a child, I decided to check this out. This is a movie that you should really pass on.<br /><br />It is "
2470,1.1975809335708618,"Saw it at UCSB's reel loud festival and was *shocked* that it won the golden reel award. I wasn't the only one, considering the audience had mixed reactions to the piece. I thought there were many oth"
1846,1.1988016366958618,"Seriously, I absolutely love these old movies and their simplicity but I just watched this for the first time last night and it easily slotted itself into my bottom five of all time. Was this supposed"
1989,1.1997445821762085,"A black guy fights ..... and supposedly wins .... yeah ... 1/10. Obviously fiction.<br /><br />So we're presented with a damm nice title, a real nice tag line and even a nice plot line .. Thats about "
1016,1.1999930143356323,"As a physics student, I've become aware of many idiot professors, and other so-called experts, in the field. As I continue with my studies, I learn more and more about real physics experiments going o"
1285,1.2006744146347046,"When I first saw this film it was not an impressive one. Now that I have seen it again with some friends on DVD ( they had not viewed it on the silver screen ), my opinion remains the same. The subjec"
1347,1.2012202739715576,Student Seduction finds Saved By The Bell Alumni Elizabeth Berkley on the other side of the desk and attracting the attention of young and hunky Corey Sevier. Speaking for myself I can truthfully say 
89,1.2023147344589233,Raymond Burr stars as an attorney caught up in the murder of his best friend (Dick Foran) thanks to his affection for his friend's wife (Angela Lansbury). This was a full year before he started doing 
160,1.2031383514404297,"I realize that living in the Western Plains of Wyoming during the 1900s was brutal, in fact, it probably is still brutal today, but was it monumental enough to transform into a seemingly ""made-for-TV"""
2796,1.2035777568817139,"This movie down-shifts from 4th into 1st without bothering with 3rd or 2nd, grinding gears all the way to the sappy, b-movie finish-line. The con at the beginning is easily the best and cleverest part"
2428,1.2038494348526,"I remember watching this movie several times as a very young kid, and there were parts of it (many in fact) that I did not understand. I think I have seen it once as an adult, and I then understood th"
643,1.203935980796814,"I was in second grade, 12 years ago. I remember it clearly. We were learning about space. All little kids want to go to space, right? Well, after I saw this, I was so scared to death that I would 'acc"
726,1.2042350769042969,I have seen every episode of this spin off. I thought the first season was a decent effort considering the expectations of following such a success that is Grey's Anatomy. Thus i have continued to wat
1532,1.204447627067566,"Despite, or perhaps in part because of the clever use of music to underscore the motivations and ideologies of each of the major characters, stereotypes are in, and verisimilitude and characterization"
1785,1.2091671228408813,"This has been put out on the DVD market by Alpha, and it's for die-hard Boris Karloff fans (like moi) only. It's not a horror flick, but a drama where Boris is a struggling scientist agreeing to kill "
1872,1.2094696760177612,"no redeeming qualities can possibly be expressed. i wish i could get my time back. nice skull face broad really smiles, bright at the camera when the disease has already wreaked enough havoc on the il"
1447,1.2125272750854492,"In a summer that also boasted such repugnant stinkers as Snakes on a Plane and The Da Vinci Code, that's a pretty bold statement. But I stand by it nonetheless. Superman Returns, like King Kong 6 mont"
893,1.2128723859786987,"Yes, definitely better than my viewing of Death Tunnel. Actually some of the deaths were pretty original and the gore was decent. It was kind of like Wrong Turn meets the Hills Have Eyes.<br /><br />B"
2567,1.2129989862442017,"Hmm I agree with the reviewer who said that ""strange people with generous tastes have been reviewing this film"". I thought the film was intriguing enough to watch it. I think that was primarily becau"
1025,1.2140707969665527,"Before I'd seen this, I had seen some pretty bad Christmas films. But once I saw this, ""Jingle All the Way"" looked better than ""The Godfather"". ""Santa Claus"" is a jolly film about Santa helping out so"
1916,1.2148970365524292,"William Lustig's followup to ""Maniac"" proves conclusively that, without Tom Savini's spectacular effects and Spinell's convincing performance, ""Maniac"" would never have become the cult hit that it did"
2342,1.215138554573059,This adaptation positively butchers a classic which is beloved for its subtlety. Timothy Dalton has absolutely no conception of the different nuances of Rochester's character. I get the feeling he nev
2333,1.2177708148956299,"The Angry Red Planet (Quickie Review) <br /><br />Like ""The Man From Planet X,"" this is a bizarre science fiction tale culled from an era where fantasy and science fiction were still damn near the sam"
