,score,review
214,-1.194693684577942,"I wouldn't go so far as to not recommend this movie, since the only problems I have with it are due to an overexposure to the plot devices used in the movie - the sort of things common to every kids movie ever made it seems. That doesn't make it bad, just not something I'd go far.<br /><br />It is a little saccharine, so I might say that for the most part anyone looking for something with a little more wit could be disappointed in an obviously for-kids movie like this.<br /><br />However, all of that goes out the window when that squirrel (the one in all the trailers) comes on-screen. His time is limited, but it seems apparent that the decision makers had the wisdom to tell these guys 'hey, could you stick in a little more squirrel?' every time it's getting intolerably dull. That doesn't save the movie, but you can leave saying 'at least there was one aspect where I couldn't stop laughing.'<br /><br />And of course, visually it won't disappoint, but that's almost a given with Pixar fli"
215,-0.6466298699378967,"I could not take my eyes off this movie when it showed up on cable. The dialogue and costumes are of a quality most readily associated with soft-core porn. In this case the expedient plot serves as a vehicle not for sex but for serial thrashings with nunchuks. (Perhaps for sex as well, but not on Indian TV, anyway.)<br /><br />Not being a fan of the genre I couldn't place Jeff Wincott, and had no leads to search from. Only once Brigitte Nielsen traded in her futuristic-nurse coif (so mayoral!) for the high-top fade we remember from Beverly Hills Cop II did I make the positive ID on her.<br /><br />This movie will no doubt entertain any admirer of early 90's couture or nod-and-wink schlock à la Paul Verhoeven. Can we add a genre tag for ""so-bad-it's-good""?"
216,-0.06467527896165848,"The film starts out very slowly, with the lifestyle of Wallace Napalm, an attendant at a photo-service drop-off station. His wife has been restricted to her home with an ankle bracelet as the result of a sentence for arson. Wallace is a member of the volunteer fire department, and takes firefighting seriously.<br /><br />As we watch Wallace's rather dull life proceeding, suddenly there comes something new and jarring: a traveling carnival comes to town. One of its stars is Wilder Napalm, Wallace's brother. He's a clown, but he has a special talent.<br /><br />So does Wallace. They're both pyrokineticists or ""pyrotics,"" people capable of starting fires through mental energy. Wallace keeps his powers secret; Wilder lets his acquaintances know what he can do.<br /><br />Spoiler: Some of their differences go back to a childhood incident where they inadvertently caused the death of a vagrant. Wallace holds back from using his powers; Wilder wants to go public on national TV.<br /><br />Comp"
217,-1.398935079574585,"Most folks might say that if one were to spend a Saturday night watching a movie,you must be really bored. Actually,I had just gotten back home from being out and turned on the TV and there it was,""Paulie"". <br /><br />I had missed the opening credits,so I didn't know the name of it but I saw that it had Cheech Marin in it,so I naturally thought I had tuned into ""Born In East L.A."" When I saw him talking to a talking parrot,I was ready to dismiss this as the kind of flop movie they show late in the night.<br /><br />Happy to say,it was better than that. As you know,if you don't already Paulie is lost and trying to get back to his original owner. Seems it's taken years to find her. What should be Paulie's advantage is actually a dis-advantage in ways. People come across a literate parrot and all they see is a way to make money or benefit themselves. <br /><br />While Cheech Marin's character ""is"" making money from him,he's not mean to him. The dance sequences with the parrots are someth"
218,-0.6583453416824341,"The significance of French title of this film, ""La Naissance des Pieuvres"" which literally means ""The Birth of the Octopuses"", is rather obscure, so it is perhaps not surprising that it has been marketed in English-speaking countries as ""Water Lilies"". The ""lilies"" of the English title are three teenage girls, Marie, Anne and Floriane, who are members of a synchronised swimming team based in the Paris suburbs, and the film is a ""coming-of-age"" drama about the development of their first sexual feelings.<br /><br />One feature of the film, perhaps unusual for a film of this type, is that it concentrates exclusively on relationships between the young people themselves. We see nothing of their parents or their teachers, and very little of the adult world at all. The three girls are very different in appearance, and are portrayed as being very different in character. The shy, retiring Marie is slim and petite and appears to be the youngest of the three. Anne is something of a plain Jane, Fl"
219,-0.16836993396282196,"This is one of those films that explore the culture clash of Eastern born people in Westernized cultures. <br /><br />Loving on Tokyo Time is a sad film about the inability of opposites to attract due to major cultural differences. Ken, rock n'roll fanatic, marries Kyoto, a Japanese girl, so that she can stay in the United States when her visa expires. The marriage is only expected to be temporary, that is, until Kyoto gains legal status again. But, Ken, who seems to be lost in every relationship, takes a liking to Kyoto and tries very hard to make things work out. This, despite his friend's urging that dumping Kyoto and getting rid of all commitments to girls is bad for rock n' roll except to inspire some song writing about broken hearts and all of that.<br /><br />But Kyoto comes from a strict traditional Japanese upbringing, and doesn't expect to be married to Ken all that long. Not only that, she is homesick and wants to return to Japan. It's sad in that this is finally someone Ken"
220,-1.0794156789779663,"This movie has several things going for it. It is a ""feel good"" story. The characters and actors are likable, realistic and present fine performances. Most important, I believe, is that Dennis Quaid knows how to grip and throw a baseball. Robert Redford looked good both throwing and swinging a bat in ""The Natural, and so did Kevin Costner in ""For Love of the Game"" and ""Bull Durham."" In ""Major League,"" Tom Berenger and Charlie Sheen looked like they knew what they were doing, but many of the others did not, and that picture was pure silliness - and not very funny. <br /><br />So many earlier baseball movies, even where the stories might be interesting, presented such a lack of baseball ability on the part of the leads, they were ludicrous in this respect. In ""The Stratton Story"" and ""Strategic Air Command,"" Jimmy Stewart looked about as believable as a professional baseball player, as your overweight, non-athletic, elderly uncle in the softball game at the family reunion. Other virile a"
221,-0.8965810537338257,"Enjoyable in spite of Leslie Howard's performance. Mr. Howard plays Philip as a flat, uninteresting character. One is supposed to feel sorry for this man; however, I find myself cheering Bette Davis' Mildred. Ms. Davis gives one her finest performances (she received an Academy Award nomination). Thanks to her performance she brings this rather dull movie to life. **Be sure not to miss when Mildred tells Philip exactly how she feels about him."
222,-1.322571039199829,"""Gespenster"" (2005) forms, together with ""Yella"" (2007), and ""Jerichow"" (2008), the Gespenster-trilogy of director Christian Petzold, doubtless one of the creme-De-la-creme German movie directors of our time.<br /><br />Roughly, ""Gespenster"" tells the story of a French woman whose daughter had been kidnapped as a 3 years old child while the mother turned around her head for 1 minute in Berlin - and has never been seen ever. Since then, the mother keeps traveling to Berlin whenever there is a possibility and searches, by aid of time-dilated photography, for girls of the age of approximately the present age of her age. As we hear later in the movie, the mother was already a lot of times convinced that she had found her daughter Marie. However, this time, when she meets Nina, everything comes quite different.<br /><br />The movie does not bring solutions, not even part-solutions, and insofar, it is rather disappointing. We are not getting equipped either in order to decide if the mother i"
223,-0.4314497411251068,"As much as I have enjoyed the Hanzo the Razor movies, three is definitely enough: 'Who's Got The Gold?', the final adventure for the Japanese lawman with the impressive package, is a fairly enjoyable piece of Pinku cinema, but offers little new in terms of ideas whilst taking a big step backwards as far as outrageousness is concerned.<br /><br />The film opens with the appearance of a female ghost, and looks as though it is going to explore supernatural territory, something which might have taken the series in an interesting new direction; unfortunately, after the spook turns out to be nothing but a Scooby Doo-style ruse (cooked up by a corrupt treasury official keen to keep people away from the lake where he is hiding stolen gold), director Yoshio Inoue is content to recycle familiar elements from the first two films, the result being a rather stale affair.<br /><br />Once again, Hanzo heads an investigation that requires him to interrogate women through the use of his mighty penis, s"
224,-1.5263476371765137,"If you were born around the time this movie was finished, and had a liberal/open minded household that I had, I'm sure during the early 80's you'd be first introduced to walking in on your parents watching dirty movies or extreme dirty movies. You know, not 100% pornographic but rather an alchemical mixture of actual drama and pornography, or that you'd sneak into their collection and pop in the plastic rectangle representation of such a film in a big dookie machine called a VHS. You had to be very quiet and ninja like but still having minor heart failure when huge pop noises were made when pressing the tablet-like buttons out of fear of being discovered. Whatever the case, such films were sent into the back of your mind, waiting and waiting to be reunited with such visual ""art"". Needless to say, this movie fits into the aforementioned description to a ""T"". Many people will comment on the extreme sexual nature of the film but perhaps due to me being desensitized, I am more disturbed by"
225,-0.7804831266403198,"I don't understand. Not being a critic, i am not evaluating the quality of the acting, which I find believable, a good thing. My confusion lies with the content. Is no one else sensitive to the fact that these two unfaithful women were justifying their infidelity to men who were fighting and bleeding to guarantee the continued freedom of their families and their country. Should there not have been a prologue informing us if the men made it home and if so, what effect their cheating ""wives'"" infidelity had on them? While these women were bedding their paramours out of a sense loneliness, did they think that their husbands were enjoying being shot at while facing death or dismemberment daily? They didn't think of their husbands at all! Only of themselves. Pardon me, except when they wished their husbands dead."
226,-0.3093735873699188,"**************Possible spoilers********** There is only one reason why I saw this movie and that was because I have a massive crush on Richard Belzer.(I don't know that much about humor) There were some part that were funny Like the Barbie and Ken Spoof and the dealers and the president skit. Mind you this is sometimes raunchy(Dare, I say crude?) It was at times funny, but it could have been better. Probably if they spent more time in the humor and less time getting women undress, the movie would had been funnier. Some skits just make you want to gag, and cringe, others skits make you laugh and oddly enough think. Sadly this movie is dated. If you have a mad crush on Richard Belzer(So worth it) it's worth checking it out and seeing chevy chase."
227,-0.6019416451454163,"Okay, we've got extreme Verhoeven violence (Although not as extreme as other Verhoeven flicks), we've got plenty of sex and nudity, but something is missing...Oh, yes, it's missing the intelligence that Paul Verhoeven is known for in his sci-fi movies. I admire the way Verhoeven introduces the characters and how they have a sense of humor, but unlike most Verhoeven films, the movie itself doesn't have enough humor for it to fall into the comedy genre. The acting overall was above average compared to most slasher films.<br /><br />What makes Hollow Man a good movie is not the story, not the cast or characters, but the amazing special effects work that would otherwise make a film like this impossible. The crew has truly made an invisible man, without the use of things like a floating hat suspended on piano wires and other practical effects (effects done on set). The most stunning effects scenes are not seen while Kevin Bacon is invisible, they are when Kevin Bacon is becoming invisible a"
228,-1.2443668842315674,"A story of obsessive love pushed to its limits and of a lovely swan whose beauty is the very ticket to her own premature demise. Placed at the beginning of talkies, PRIX DE BEAUTE walks a thin line in being a full-on silent film -- which is still is at heart -- and flirting with sound and sound effects. The effect is a little irritating for anyone coming into this film because the recorded audio is extremely tinny and just doesn't help it at all. Hearing sound stage conversation edited over the beginning sequence which takes place in a beach, for example, is as part of the movie as the actress who dubs Louise Brooks' dialog and in doing so robs the audience of a fine performance. Other than that, the movie rolls along more or less well, with little jumps in continuity here and there -- something quite common in films from this era -- and has that vague sped up feel typical of silents. In a way, this is an experiment of a movie, and closer to the style of Sergei Eisenstein in visual pre"
229,-1.6520854234695435,"Preminger's adaptation of G. B. Shaw's ''Saint Joan''(screenplay by Graham Greene) received one of the worst critical reactions in it's day. It was vilified by the pseudo-elite, the purists and the audiences was unresponsive to a film that lacked the piety and glamour expected of a historical pageant. As in ''Peeping Tom'', the reaction was malicious and unjustified. Preminger's adaptation of Shaw's intellectual exploration of the effects and actions surrounding Joan of Arc(her actual name in her own language is Jeanne d'Arc but this film is in English) is totally faithful to the spirit of the original play, not only on the literal emotional level but formally too. His film is a Brechtian examination of the functioning of institutions, the division within and without of various factions all wanting to seize power. As such we are not allowed to identify on an emotional level with any of the characters, including Joan herself.<br /><br />As played by Jean Seberg(whose subsequent life off"
230,-0.14020362496376038,"""Sasquatch Hunters"" actually wasn't as bad as I thought.<br /><br />**SPOILERS**<br /><br />Traveling into the woods, Park Rangers Charles Landon, (Kevin O'Connor) Roger Gordon, (Matt Latimore) Brian Stratton (David Zelina) Spencer Combs, (Rick Holland) and his sister Janet, (Stacey Branscombe) escort Dr. Helen Gilbert, (Amy Shelton-White) her boss Dr. Ethan Edwards, (Gary Sturm) and assistant Louise Keaton, (Juliana Dever) to find the site of some reputed bones found in the area. When they make camp, the team discovers a giant burial ground and more strange bones littering the area. When members of the group start to disappear, they start to wander through the woods to safety. It's discovered that a Sasquatch is behind the killings, and the team band together to survive.<br /><br />The Good News: This wasn't as bad as I thought it would be. The movie really starts to pick up some steam at around the half-way point, when the creature attacks. That is a masterful series of scenes, as th"
231,-1.2004412412643433,"Seven Pounds stars Will Smith as Ben Thomas, an IRS collection agent who has an ulterior motive for meeting those who have gotten behind on their tax payments. Thomas caused the deaths of seven people whilst driving talking on his phone and the movie follows his attempt to try and atone for his, quite frankly, unforgivable crime.<br /><br />The story line is as subtle as a brick through a green house window. What you see is exactly what is happening - even the ending of Titanic was more surprising when compared to Seven Pounds. There is absolutely no twist whatsoever, there is never any confusion or doubt as to what is happening.<br /><br />Normally I only like Will Smith when is in full Bad Boys mode. The guy is at his best when sporting a gun, driving a Ford GT and saying ""Aw Hell Nah"" as whenever he tries to act serious it only comes across as a pathetic attempt at trying to gain an Oscar which he is so obviously is desperate for. This is probably the main reason why I wasn't lookin"
232,-0.34830135107040405,"CREEP is a straight up serious horror film set in real time that wants nothing more than to just show people get attacked in a empty subway platform by a mutant for 85 minutes. And it does just that. Nothing more, nothing less. Director Christopher Smith draws out the drama a far as he plausibly can by introducing a series of characters that would actually have a reason to be in the subway after it is locked. He also leaves the origins of the titular Creep deliberately vague (unlawful experiments happening in the 60s underground are hinted at) and that little bit of mystery works for the most part. Sadly, he undermines himself toward the end by actually holding back from a twist ending where more genetic malformations would appear (they are hinted at as well). Yes, you heard me right - I wanted a clichéd twist ending! Franka (RUN LOLA RUN) Potente is good as the terrorized female lead and the rest of the cast is fine."
233,-0.6872645020484924,Some bad reviews here for this and I understand why but treat it as a low budget serial killer film and you might get more from it than most.<br /><br />I thought that this worked in a way because afterwards I felt dirty and wanted to take a long shower so that is some degree of success isn't it?<br /><br />I would say there is just the right level of sleaze here to get under your skin although the acting is maybe a bit too uneven. David Hess is only in this brielfy so don not get your hopes up to much if you like Last House.<br /><br />Other than that - worth a look.
234,-0.5613822340965271,"What's Good About It: Some inventive and genuinely creepy little effects that will get under the skin of even the most seasoned horror fan. Doesn't rely on the hackneyed soundtrack stabs for its ""gotcha"" moments. Even if you've seen everything, there's still a few things in this film that will make your jaw drop.<br /><br />What Could Have Been Better About It: The acting was, at times, flat and unconvincing. It had a ""shot-on-video"" quality in some places (though,it mostly achieved the atmosphere it was striving for), and the camera work is full of needless close-ups of meaningless actions. Though the effects are genuinely creepy, I think they may have gone to the well a few too many times with some of them. The ending seemed rushed, and glossed over what could have been more impactful moments. The viewer is left to figure out a lot of things for themselves, not as a challenge by the filmmakers, but because they just missed it.<br /><br />Still, a good little indie horror film that is"
235,-0.700416088104248,"Miike makes a children's adventure film, not unlike The Neverending Story. It's actually one of my least favorite of the director's films. Even the worst Miike is better than a good many films, though, and The Great Yokai War has a lot in it that's worth recommending. It's at least as loud and obnoxious as most American kiddie flicks. I might think kids themselves would find a lot to like in it (the DVD includes an English dub), but, like all of Miike's films, it can tend to move very slowly. That means you've got kind of a weird unevenness, where sometimes there's a loud action sequence and the next scene will drag on forever as characters converse. The story itself isn't very good, either, and Miike's perpetual flaw of incoherency rears its ugly head. Most of what I liked came from the technical side of things. This has to be Miike's most expensive movie, and it looks fantastic. ""Yokai"" are Japanese spirits, and they come in all different, fantastical forms, and the costume designers"
236,-0.15098147094249725,"Homelessness (or Houselessness as George Carlin stated) has been an issue for years but never a plan to help those on the street that were once considered human who did everything from going to school, work, or vote for the matter. Most people think of the homeless as just a lost cause while worrying about things such as racism, the war on Iraq, pressuring kids to succeed, technology, the elections, inflation, or worrying if they'll be next to end up on the streets.<br /><br />But what if you were given a bet to live on the streets for a month without the luxuries you once had from a home, the entertainment sets, a bathroom, pictures on the wall, a computer, and everything you once treasure to see what it's like to be homeless? That is Goddard Bolt's lesson.<br /><br />Mel Brooks (who directs) who stars as Bolt plays a rich man who has everything in the world until deciding to make a bet with a sissy rival (Jeffery Tambor) to see if he can live in the streets for thirty days without th"
237,-1.2456817626953125,"This picks up about a year after the events in ""Basic Instinct"". Catherine Tramell (Sharon Stone) is now in London. While having sex with a soccer player while speeding about in a car going at 110 miles/hour (don't ask) she goes off the road and ends up in the Thames. She survives--he doesn't. The police hire psychiatrist Michael Glass (David Morrissey) to see if she's mentally competent to stand trial. Naturally she starts playing with his mind instead and plenty of murders and sex follow.<br /><br />This movie was doomed before it even opened. It took forever to get a cast and director, script problems were constant and the cast was not happy (Morrissey complained about the movie often). Still it's not too bad. It's a lot like the first--there's a lush music score, beautiful locations, plenty of sex and nudity (this had to be edited for an R), a nicely convoluted plot and good acting--but there's no impact. It feels like a retread of the first. People are being killed here with a cho"
238,-0.20115503668785095,"Typical 90's comedy, situational comedy similar to our modern day ""My Family"". Thatcher being the height of most political jokes, Bill (Belinda Lang) blames Thatcher for anything she can. ""Bloody Thatcher"" possibly shared with most of us. David the typical teenager, cutting up brains with bread knives, Jenny, the moody older teenage child, only interested in boys and more boys. Bill and Ben working as much as they can to keep their family afloat struggling within the economical climate of the early 90's. Granted the first two series were not as successful as the latter however, series 3 onwards is where it all kicks off with more laughs that i care to count. overall this show didn't get the best viewing times and they ought to have held on a bit longer. clearly they couldn't have carried on after Gary Olsen died but i think they should get rid of ""catherine Tate"" ""the office"" ""little Britain"" and bring back the classics!"
239,-1.307673692703247,"I liked Top Gun. It held my interest. Predictable plot, decent character development and story line. It is pretty similar to High Noon in that the town people appear weak and scared to stand up to a villain. This movie has some quality actors who really did not get a chance to share all of their talents. Also some of the actors did not receive credit for their roles. Denver Pyle was a good looking man in his younger days. John Dehner, Rod Taylor are outstanding in their roles. Sterling Hayden did the best that he could with poor material. It is hard to imagine him as a gunslinger. Laura, played by Karen Booth, was a nauseating character. She seemed flattered that two men may have been fighting over her. Ugh. Finally, How can people travel without luggage? Especially women."
240,-2.83565092086792,"Stupid, Stupid, Stupid. I think that Angelina Jolie is probably one of the most talented actress' today, but a movie like this isn't just worth her time. She deserves better, and so does everyone else in this movie. Talent is just wasted. Sorry, but i don't feel like writing a review for this.<br /><br />I give it NO stars out of *****."
