,score,review
0,-0.2797081172466278,"A year after losing gorgeous Jane Parker (Maureen O'Sullivan) to love rival Tarzan, hunter Harry Holt (Neil Hamilton) returns to the jungle to have another bash at winning the brunette babe's heart. Mixing business with pleasure, he also plans to grab himself some ivory from the elephant graveyard that lies beyond the Mutia escarpment, Tarzan's stomping ground.<br /><br />Accompanied by his slimy, womanising pal Martin Arlington and a group of expendable bearers, Harry finally arrives at his destination (having narrowly avoided death at the hands of savage natives and rock-hurling apes) only to find that Jane is still infatuated with her musclebound yodeller, and worse still, that Tarzan is refusing to let the hunters take any ivory from the graveyard.<br /><br />Nasty Arlington decides to resolve matters by ambushing and shooting the ape-man and then telling Jane and Holt that Tarzan was attacked and eaten by a crocodile. Of course, Tarzan isn't deadonly wounded; after being nursed b"
1,-1.990532636642456,"I thought the racism and prejudice against Carl Brashear was grossly overdramatized for Hollywood effect. I do not believe the U. S. Navy was ever that overtly racist. I cannot imagine a full Captain, the Commanding Officer, ever telling his Chief to intentionally flunk anyone. Certainly not at the risk of his life. And there has never been a Chief Petty Officer as unabashedly prejudice against everybody but WASPs as DeNiro's character. No Chief as slovenly and drunken as he was played would have ever risen to Master Chief in the first place. Cuba Gooding saved an otherwise badly done movie."
2,-0.7578542232513428,"The costumes and make-up were grand, there were some exceptionally funny lines, and the role was made for Jim Carrey. Carrey did as good a job as could be done given the rather disappointing script writing. Sure this was mostly a movie for kids, but if you are going to spend this much money making a movie you really ought to at least give the story enough body to go beyond that of Dr Seuss. I expected more from Ron Howard. It's worth a see, but it lacks the necessary qualities to become a major classic, by any measure."
3,-0.7376062273979187,"Tales from the Crypt: And All Through the House starts on Christmas Eve as Elizabeth (Mary Ellen Trainor) kills her husband Joseph (Marshall Bell), she drags his body outside ready to throw it down a well but while doing so misses an important news bulletin on the radio that says a homicidal maniac (Larry Drake) dressed as Santa Clause has escaped from a local mental asylum & has already killed several women with Elizabeth next on his list but she has other ideas & tries to turn the seemingly dangerous situation to her advantage...<br /><br />This Tales from the Crypt story was episode 2 from season 1, directed by the one of the show's regular executive producers Robert Zemeckis And All Through the House is a decent enough watch. The script by Fred Dekker was actually based on a story appearing in the comic 'The Vault of Horror' & was originally adapted to film as one episode from the Britsih horror anthology film Tales from the Crypt (1972) which starred Joan Collins as the murderous "
4,-0.07004792243242264,"This was a great movie but it had the worst ending I think I have ever seen!!! The actors were great and displayed wonderful talent. The entire story was twisted and unexpecting, which, is what made it entertaining. As good as the movie was, the entire film is judged by the ending, which was terrible! Maybe a sequel could eliminate this bad ending."
5,-1.0551701784133911,"I appreciated the photography, the textures, the colours and often, unlike one comment, the lighting. What was lacking for me was a coherent storyline.I found it often disjointed, badly edited and at times difficult to follow. My version was 110 minutes, IMDb shows one at 125m. Possibly the cuts and subtitles didn't help. I applaud any films that escape from the Hollywood mould but this left me disappointed. Miss Gillain was luminous and the performances were all fine, I just wanted a little more dialogue. If anyone would like to see another film that has some affinity with this one, try 'Hideous Kinky'with Kate Winslet."
6,-0.08335046470165253,"As with all environmentally aware films from the 1970s SOYLENT GREEN has a rather cheesy view of what ecological meltdown is . Overpopulation means there`s too many people to feed ? I was under the impression that famines were caused by either war or failed economic policies . Stalin`s policy in the Soviet Union in the 1930s left millions dead because of famine and to this day the greatest man made tragedy was Mao`s rural policy in China which led over 30 million starvation deaths in the 1950s . And let`s not forget the great famines in the horn of Africa in the 1980s and 90s which were to do with conflicts not overpopulation . You might like to also consider that two of the most heavily populated areas on Earth , Hong Kong and Macau , have never suffered a famine in modern times . Likewise the expansion of shanty towns around cities as seen here isn`t strictly down to overpopulation - it`s down to economic factors where people flock to cities to find better paid work than in the count"
7,-0.5436484813690186,"This is one of the oddest films of the Zatôichi series due to its very unusual pacing and the role that Ichi plays in the film. Interestingly enough, this was the first Zatôichi film made by Shintaro Katsu's new production company. Now, instead of just playing the blind swordsman, Katsu is in charge of making the films. This could easily explain why this film seems so different in style to the previous 15 films. As far as Ichi's role, the film is very different because he isn't in the film as much as usual. He's also easy to fool and actually, for a while, does a lot to harm people instead of helping! <br /><br />""Zatôichi Rôyaburi"" begins with Ichi talking with an old lady who tries to take advantage of his blindness. Oddly, in this scene, Ichi says that he's been blind since a toddler, though in an earlier film he says his blindness set in when he was 8. This is a minor mistake, and only a crazed fan like myself would have noticed.<br /><br />This film takes place over a period of at"
8,-1.3675670623779297,"I never seem to write a review on IMDb unless I am extremely surprised at how good, or how bad, a movie is. This film falls into the first category. Every year, I try to see all the nominees for Best Foreign Film at the Oscars, even those that I know I won't like. ""As It Is In Heaven"" seems to fit the bill. The plot sounds sugary and sentimental and slow....For my tastes, which run more towards original, dark and/or daring foreign cinema (Michael Haneke, Francois Ozon, A lot of modern Japanese/Korean cinema) ""As It Is In Heaven"" does not sound particularly interesting....It didn't get released in the USA, so I sat down to watch a VCD I found in Singapore, preparing to ""cross it off the list"". After a dull beginning, ""As It Is In Heaven"" becomes that rare film where you really become inspired by what is happening on screen. Weak points: The characters in the film are pure ""stock"" characters- the Wounded Dreamer, the Town Bully, the Battered Wife, the Loose Woman Yearning for Love, the R"
9,-1.4210659265518188,"I have read modesty Blaise for several years now, collecting numbers of the strip. After the fiasco movie made many years ago based on the first book ""Modesty Blaise"" I was surprised the result got this good.<br /><br />What I got was a movie not based on action or violence. The director had focused on history and psychology. How was Modesty created based on the own tale and what parts in her life was affected by her non-childhood. I think this thougths will give a greater understanding to the next (I hope) film. I simply loved the movies old-fashioned style.<br /><br />However everything wasn't that good, the gambling wasn't that good. almost boring and unreal. The acting could have been improved too. I'm not thinking the bad guy in this movie felt real, the only reason he was there was so Modesty could have someone to tell her story for. Also they could have expanded the movie, showing more about when she builds up ""The network"" but I'll guess thats for the next movie.<br /><br />And"
10,-1.0246782302856445,"TO all of yall who think 1.This was a boring telecast 2.Halle berry and denzel Washington did not deserve their Oscars<br /><br />SHUT THE F**k UP!! This was one of the best Academy awards show because 1.It was a moment in history to have a black yes ""Black actress"" win an academy award for Best actress so many of our black sisters have been ignored by the academy for many years.To be honest I had stop watching the academy awards because of a lack of diversity in either the winners or nominees.To me it was nothing but a bunch of white people patting each other in the back.the academy had many chances to vote black actresses that were brilliant in movies eg Alfre Woodard,Whoopi Goldberg,Diana Ross,Mary jean Babtise, but it did not 2.Halle berry deserved that Oscar no competition the academy was under pressure to vote for her so long have deserving actresses been ignored by the academy the majority of which is comprised of white voters yeah yeah Nicole kidman sang very prettily in muling"
11,-0.03578948974609375,"It's interesting how the train of research can flow. I started out looking at an article about Cristo's ""The Gates"" in Central Park. The article stated that the Maysles had been Cristo's filmographers for years. Hmmm... Then I got to looking at their body of work. I believe one of them has passed on but the other is still filming Cristo and Jean Claude in their stages of creation. Grey Gardens sounded very interesting. Video Station, in Boulder CO, is the place to look for the obscure or offbeat and of course they had it in stock. DVD and VHS. Edith and Edie are women living in the past, and oh what a glorious past it was. Edith had been well off, born a Bouvier, married well, had several wonderful relationships and became a singer when she was in her forties. Her daughter Edie had been a débutante, a fashion model and had many beaus. She never married and at some point in her thirties had come home to recuperate. She seems to have a nervous disorder of some kind. Worrying too much abo"
12,-0.7694441676139832,"I was never a big fan of horror movies. They usually try cheap tricks to scare their audiences like loud noises and creepy children. They usually lack originality and contain overacting galore. The only horror movie i like was Stir of Echoes with Kevin Bacon. It was well-acted, and had a great story. But it has been joined and maybe even surpassed by Stanley Kubrick's The Shining, quite possibly the scariest movie ever.<br /><br />The movie follows a writer (Jack Nicholson) and his family who agree to watch over a hotel while it is closed for the winter. There were rumors of the place being haunted and the last resident went crazy and murdered his family. But Jack is convinced it will be OK and he can use the quiet to overcome his writer's block. After months of solitude and silence however, Jack becomes a grumpy and later violent. Is it cabin fever or is there something in the hotel that is driving him mad?<br /><br />One of the creepiest parts about the movie is the feeling of isolat"
13,-0.9013087749481201,"This is a bit of a puzzle for a lot of the artsy Lynch crowd. They tend to try to write this off as some kind of meaningless, crude, side project of Lynch's. Like this is Lynch passing gas between his real pieces of film art. Well it may be a fart, but its one of those intriguing farts that you catch of a whiff of and are embarrassed to admit you enjoy.<br /><br />Dumbland distilled down beyond this is art. What can you do with aspects of modern life but laugh at it. If you took it seriously you would go nuts. You hook into it, smell it, taste it, feel its agonies, its unreasoning stupidities, and then express it in any medium you choose. Thats called art, and art isn't dumb. But it is Dumbland."
14,-0.19979916512966156,"Page 3 is one of those films Madhur Bhandarkar makes to expose societal filth. The film is compelling, but, like most of Bhandarkar's films, it is one-sided and overly pessimistic. This film is all about tabloid journalism, gossip, celebrities. The film exposes the lives of socialites, whose lifestyle is disastrously boastful, peculiar and repulsive. They party, they care for nothing but fame, they plan parties at funerals, they are craving for more money and a higher reputation, they will do anything to get due exposure in the media, to get their names boldly printed on the daily newspaper's social column known as ""Page 3"" with huge photographs which will be the center of people's discussions. They are attention seeking, salacious and hypocrite. The film industry is shown as sleazy, with casting couch being a common phenomenon among filmmakers. That's where our lovely heroine, a young social column reporter Madhvi Sharma, is thrown. All these people from Mumbai's elite depend on her a"
15,-0.7586425542831421,"Mitchell Leisen's fifth feature as director, and he shows his versatility by directing a musical, after his previous movies were heavy dramas. He also plays a cameo as the conductor.<br /><br />You can tell it is a pre code movie, and nothing like it was made in the US for quite a while afterwards (like 30+ years). Leisen shot the musical numbers so they were like what the audience would see - no widescreen shots or from above ala Busby Berkeley. What I do find funny or interesting is that you never actually see the audience.<br /><br />As others have mentioned the leads are fairly characterless, and Jack Oakie and Victor McLaghlan play their normal movie personas. Gertrude Michael however provides a bit of spark.<br /><br />The musical numbers are interesting and some good (the Rape of the Rhapsody in particular is amusing) but the drama unconvincing and faked - three murders is too many and have minimal emotional impact on the characters. This is where this movie could have been a lo"
16,-2.070136547088623,"WAR, INC. (2008) **1/2 John Cusack, Marisa Tomei, Hilary Duff, Joan Cusack, Ben Kingsley, Dan Aykroyd, Sergej Trifunovic, Lyubomir Neikov, Ned Bellamy, (Voice of: Montel Williams)<br /><br />A hit-and-miss-21st Century ""STRANGELOVE""<br /><br />John Cusack  who co-wrote the script with Mark Leyner and Jeremy Pikser  stars as a jaded hit-man named Brand Hauser who is burnt out but decides to follow thru on one final assignment by icing a Middle-Eastern oil minister named Omar Sharif (yes, not THAT Omar Sharif but you get the tone here from this misfire for a laugh) commandeered by the ex-Vice President of The USA (Aykroyd, Cusack's old ""Grosse Pointe Blank"" co-hort, doing a mean Dick Cheney manqué turn here), enlisting Brand to do the deed under the guise of a Trade Show Producer in mythical Turaqistan (read: Iraq/Afghanistan) for the American private corporation Tamerlane (read: Halliburton). <br /><br />While being briefed Brand is faced with a moment of clarity when he comes across "
17,-0.45775794982910156,"Kirk and crew land on a lonely planet where the sun is about to explode. They intend to evacuate the inhabitants but find the place deserted except for a Mr. Atoz who operates some sort of high-tech library. Despite trying to get a straight answer from him about everyone's whereabouts, Atoz is indifferent to their questions and insist they must quickly 'make a selection while there is still time'. They have no idea what he's talking about but wander about looking at the hand mirror-like disks on the viewers and they see images of the planet's past. Then, while a disk is in the viewer, Kirk runs through the doorway and is magically transported back in time to what on Earth would look like the time of Louis XIV (the 1660s). When McCoy and Spock follow, a different disk is in the viewer and they are sent to an ice age hell. All too late they realize that the library is a time travel machine and repository.<br /><br />While Kirk's visit is pretty short and not all that exciting, Spock and "
18,-1.1841644048690796,"A true anomaly in the French cinema ,this despairing work has no equivalent in the contemporary production.One would rather have to look on the side of Louis Malle's ""le feu follet"" (1963)(the fire within) to find something not completely unlike Harel's effort.Wry and cynical,having lost all his illusions,the hero ,a computer scientist,has got no more reason to live.Absolutely none.Estranged from the human race,he seems to live his life as some kind of entomologist,studying his colleagues.One of them catches his attention:Tisserand-José Garcia plays the most demeaning part of the decade-.Then Tisserand will become some kind of prey:all his pessimism will rub off on this poor man.The scene is the night-club climaxes the strange relationship:the hero tells his victim that his life will always be unfulfilled unless he.... Well now the movie takes a more conventional turn so to speak (Clouzot's misanthropy maybe)but just for a while.<br /><br />The form is weird beyond comment There are tw"
19,-0.8881823420524597,"I'm not kidding about that summary and vote! The video distributors have packaged this as just another typical '80s werewolf movie, but it is in fact the greatest parody of the horror genre that you can imagine, having done for the horror movie what ""Blazing Saddles"" did for the western. I have seen plenty of comedies - good, bad, stupid, weird, etc. (usually walking away unimpressed), and I think that comedy must be the most difficult genre for filmmakers and actors to work in - it takes just the right kind of touch to make things successful, and part of that is having good ideas. ""Full Moon High"" is bulging with good ideas - so many, in fact, that it can easily put the Zucker/Abrams team of ""Airplane"" and ""Naked Gun"" to shame. One of the best of these is the very presence of Ed McMahon in a starring role as a John Birch-style right-wing crackpot. The jokes, non-sequiturs, wisecracks and word-play are literally non-stop and everything, including the kitchen sink, has been thrown in. T"
20,-1.9353108406066895,"Back in the forties, when movies touched on matters not yet admissible in ""polite"" society, they resorted to codes which supposedly floated over the heads of most of the audience while alerting those in the know to just what was up. Probably no film of the decade was so freighted with innuendo as the oddly obscure Desert Fury, set in a small gambling oasis called Chuckawalla somewhere in the California desert. Proprietress of the Purple Sage saloon and casino is the astonishing Mary Astor, in slacks and sporting a cigarette holder; into town drives her handful-of-a-daughter, Lizabeth Scott, looking, in Technicolor, like 20-million bucks. But listen to the dialogue between them, which suggests an older Lesbian and her young, restless companion (one can only wonder if A.I. Bezzerides' original script made this relationship explicit). Even more blatant are John Hodiak as a gangster and Wendell Corey as his insanely jealous torpedo. Add Burt Lancaster as the town sheriff, stir, and sit bac"
21,-1.6649199724197388,"The men can slaver over Lollo, if they like (or her lollos--she gave her name to a slang terms for breasts in French), but the ladies have an even tastier morsel in the divine Gerard Philipe, who is not only beautiful but can act. Don't be deterred if your version has no subtitles because in this simple, dashing story of love and war, in which all is fair, they are not needed. All you need know is that, at the beginning of the film, Lollobrigida reads Philipe's palm and tells him he will marry the daughter of the king. Thereafter the story is quite plain from the Gallic gestures and the running, jumping, and swordplay.<br /><br />On the minus side, the obviousness of the story and the heavy-handed facetiousness of the tone become somewhat wearying, and it is annoying that the French apparently consider themselves too superior to Hollywood to bother even attempting the plausibility of its exciting stunts. And of course the non-French-speaker misses the occasional bit of ooh-la-la, such "
22,-0.07468847930431366,"Larry Fessenden has been thrashed by most of the comments on this forum. Well, the worst mistake, evidently, is the marketing of the movie and the way the DVD might have been targeted. Obviously, this is not a true horror movie, at least, not for people expecting anything that will be gory and instantly satisfying. <br /><br />""Wendigo"" is basically a film that seems to be told from the mind of the young Miles. Things that are not readily understood by children tend to stay in their young minds and ultimately dominate their fears and the menacing world they can't comprehend. It is obvious that Kim, the mother, is a psychologist, but she has no clue to what is going on in the mind of her son. This is also a story of alienation. It's clear that the father, George, is a distant figure, perhaps a workaholic, who seems to be living in a different world.<br /><br />Miles' fears reach a point of crisis during the week end in the country. That part of New York state, with its winter landscape,"
23,-0.038257814943790436,"This was one of the DVD's I recently bought in a set of six called ""Frenchfilm"" to brush up our French before our planned holiday in beautiful Provence this year. So far, as well as improving our French we have considerably enhanced our appreciation of French cinema.<br /><br />What a breath of fresh air to the stale, predictable, unimaginative, crash bang wallop drivel being churned out by Hollywood. What a good example for screenplay writers, actors, directors and cinematographers to follow. It was so stimulating also to see two identifiable characters in the lead roles without them having to be glossy magazine cover figures. <br /><br />The other thing I liked about this film was the slow character and plot build up which kept you guessing as to how it was all going to end. Is there any real good in this selfish thug who continually treats his seemingly naïve benefactor with the type of contempt that an ex-con would display? Will our sexually frustrated poor little half deaf heroine"
24,-0.30742159485816956,"All the folks who sit here and say that this movie's weak link is the Ramones would probably say that Amadeus was ok if not for that irritating harpsichordist. Rock and Roll High School was centered around the Ramones. How anyone can watch this and not get a kick out of Joey Ramone eating bean sprouts backstage in an attempt to keep him in performing condition is obviously a wet blanket square daddy-o. Ms Trogar, exploding white mice, the hall patrols...instant classics. Nevermind the Riff Randell character.<br /><br />If you don't like the Ramones then you don't know rock and roll and you don't deserve to watch a movie called ROCK AND ROLL High School."
25,-0.12323940545320511,"New York, I Love You is a collective work of eleven short films, with each segment running around 10 minutes long. The shorts don't exactly relate but they all have something in common, love. Every short is about finding love, either if it's about a couple or just two strangers chitchatting.The film stars an ensemble cast, among them Shia LaBeouf, Natalie Portman, Hayden Christensen, Orlando Bloom, Chris Cooper, Andy Garcia, Christina Ricci, Irrfan Khan, Robin Wright Penn, Julie Christie, Ethan Hawke, Bradley Cooper, Rachel Bilson, and Anton Yelchin. With such a stellar cast and such an interesting premise, I was expecting a tremendous film; the problem is New York I Love You doesn't add up. It remains the sum of its parts. Some of the segments are funny, original and interesting but others are so meaningless (Orlando Bloom/Christina Ricci and Ethan Hawke/Maggie Q segments) that it's appalling. The film is definitely uneven and has a very experimental tone. Story-wise, it seems like so"
26,-0.2726672291755676,"This did for crime what ""Not Another Teen Movie"" did for school. I laughed all the way through as 2 inept gangs warred with each other and among themselves. An unsubtle comedy using overt jokes and gags that kept me rolling all the way. I suppose the biggest gag in the entire film was that time never seemed to go forward leaving the characters trapped in the 30's."
27,-0.6980510950088501,"Having read some of the other comments here I was expecting something truly awful but was pleasantly surprised. REALITY CHECK: The original series wasn't that good. I think some people remember it with more affection than it deserved but apart from the car chases and Daisy Duke's legs the scripts were weak and poorly acted. The Duke boys were too intelligent and posh for backwood hicks, the shrunken Boss Hog was too cretinous to be evil and Rosco was just hyper throughout every screen moment. It's amazing the series actually lasted as long as it did because it ran out of story lines during the first series.<br /><br />Back to the movie. If you watch this film in it's own right, not as a direct comparison to however you remember the TV series, then it's not bad at all. The real star is of course the General Lee. The car chases and stunts are excellent and that's really what D.O.H. is all about. Johnny Knoxville is his usual eccentric self and along with Seann William Scott as Cousin Bo "
