,score,review
667,-1.002890706062317,"Dana Andrews is one of those actors that I've probably seen in a dozen films, but who has never really registered for me. Often stolid, taciturn, playing the same kinds of roles and looking somewhat like the similarly underrated Glenn Ford, he's an actor that takes some effort to really appreciate; but once you hit the right film....<br /><br />And this is it. Preminger's moody look at New York's underbelly is as dirty and seedy as just about any 50s noir, and Andrews is in his element as too-tough cop Mark Dixon who just doesn't know how to play the game to get ahead: he hates criminals too much to always play by the rules. Early on in the film, he accidentally kills the witness to a murder involving an illegal crap game set up by a mobster who Dixon hates for personal reasons, and he spends the rest of the film trying to cover up his involvement and bring the mobster to his kind of ""justice"". Along the way he gets involved with the estranged wife of the man he killed (Gene Tierney) a"
668,-0.5368860363960266,"This movie is horrible, but you have to see it because of that. I'm not here to discuss the entire film, just the greatest chase scene ever. When Eddie dumbs milk on Tim, he gets chased down the hallway. Eddie puts obstacles in the jocks way with hilarious consequences (like a cymbal nailing a trumpet player; buy the DVD and watch it slow). The best obstacle is a knocked over mop bucket which one jock jumps over but proceeds to slide on the ground out a door. But when he slides he picks up speed thus defying physics (mainly friction); yet what lies behind the door is supreme. The steepest stair case in any school ever, which this jock proceeds to CLEAR in the air. In reality he probably would die of a broken neck. Not only does he defy all concepts of reality, he makes the funniest noise ever made in that situation. Go and buy this one. Trust me this scene is worth your 6 bucks."
669,-1.0741578340530396,"The premise of this movie has been tickling my imagination for quite some time now. We've all heard or read about it in some kind of con-text. What would you do if you were all alone in the world? What would you do if the entire world suddenly disappeared in front of your eyes? In fact, the last part is actually what happens to Dave and Andrew, two room-mates living in a run-down house in the middle of a freeway system. Andrew is a nervous wreck to say the least and Dave is considered being one of the biggest losers of society. That alone is the main reason to why these two guys get so well along, because they simply only have each other to turn to when comforting is needed. Just until...<br /><br />Straight from the beginning of the film lots and lots of problems happen to them. Both of them get involved with crime, Andrew suffers from paranoia and simply doesn't dare going out of the house. Dave is unsuccessful at his job and his colleagues don't treat him very well and with the resp"
670,-0.3356032073497772,"A Scanner Darkly, Minority Report, Blade Runner, Sin City and Sky Captain and the World of Tomorrow  if you are a fan of any of these then this will be well worth checking out.<br /><br />French animation project 'Renaissance' took seven years to make on a shoestring budget and tonight I finally got to see it at a private screening for the International Film Festival in Stockholm. My spontaneous reaction is awe; my further reflection is 'huh, neat' and closer analysis regrettably gets a resounding 'meh'. It is a gorgeous science fiction triumph on the surface, but scratch it or even poke it a little and its unnecessarily complex plot becomes glaringly apparent, as do the flat characters. <br /><br />Nevertheless it is clear that the people at Onyx films have done something spectacular with the aforementioned surface. The visuals are staggering. They have used live action motion capture fitted into key-frame animation, with stark jet black and bright white contrasts and a heavily shado"
671,-0.7232115268707275,"Its a shame she didn't get screen credit , she by far did the best job in the film has the girl on the cross , best part of the movie .She had much more impact than Avril , or just about anyone else in the film . She almost made S/M look like fun ! She really was believable has the S/M model that gets scared of her situation . Although they seem to really have messed up that sort of dreamy feeling of looking for the bad guy , Those sets were very well built but they just sort of skimmed the surface of what was shot . This is one film were both cuts should be made available. It seems they left out a lot of what was shot , and almost all of the really dark stuff that would have made the film much more demented . Its kind of like they stopped short of the mark they were going for during filming . What was shot would not have gotten a R rating probably a NC-17 or X , but that is what it would have needed to make the film they way it should have been ."
672,-1.2339093685150146,"Bellocchio refers to this as a mainly political movie, a description of the revolutionary movement in Italy, but that seems more metaphor than reality. Well, almost everything in the movie seems like metaphor. The revolutionaries, of whom we see and about whom we learn very little, might as well be mafiosi. Out with the old and in with the new.<br /><br />Andrea's Papa, a psychoanalyst, seems to stand for the usual traditional bourgeois values -- morally upright, unperturbed, clean and tidy, thoroughly ritualized.<br /><br />Giullia, the girlfriend of a revolutionary, seems to represent what can happen to someone who needs very badly a cause to support but is unable to muster up the kind of devotion such a commitment demands. (I'm guessing here.) Andrea, the adolescent boy, seems to be the only guy in the movie who is not in some unquiet way ""upatz."" He's respectful of his father but disobedient too. He loves Giullia, or so we assume, although he's not really old enough to have learned"
673,-0.7652817368507385,"Leslie Charteris' series of novels of the adventures of the slightly shady Simon Templar (""The Saint"") was brought to the screen in the late 1930s with the up and coming George Sanders as Templar. It was a careful choice - Sanders usually would play villains with occasional ""nice roles"" (ffoliott in FOREIGN CORRESPONDENCE, the title hero in THE STRANGE CASE OF UNCLE HARRY, the framed ""best friend"" of Robert Montgomery in RAGE IN HEAVEN). Here his willingness to bend the rules and break a law briefly fit his ""heavy persona"", while his good looks and suave behavior made Templar a fit shady hero like Chester Morris' ""Boston Blackie"", and (to an extent) Peter Lorre's ""Mr. Moto"". <br /><br />The films are not the best series of movie mystery serials - but they are serviceable. Like Rathbone's Holmes series or Oland's Chan's series the show frequently had actors repeating roles or playing new ones (the anti-heroine in the film here was played by Wendy Barrie, who would show up in a second fi"
674,-0.06577884405851364,"There are moments in the film that are so dreadful, your teeth ache. But knowing that there were only weeks left before the Code made movies innocuous and bland, Paramount rushed this into production before innuendo and leering went out of style. Vanities is so horrifically anti-female that it's delicious. As Kitty Carlisle sings, women are displayed with price tags that would insult a Bronx hooker. They emerge from clams (nudge,nudge;wink,wink) in postures of absolute submission. Minions of the law, so stupid they cannot find the door, get to look up their skirts and snicker. Bare-breasted chorus girls sit uncomfortably in giant cacti (Could they be a source of hallucinogens, perhaps?) while we listen to ""Sweet Marijuana"" and watch as blood falls on a chorines's breast.<br /><br />Sure, Carl Brisson learned his lines phonetically and doesn't seem to have a clue what he is saying. But it's all worth it as Norma steals the show while no one is looking.<br /><br />Taking one moment of th"
675,-1.6943565607070923,"This project was originally conceived as the movie version of popular Japanese manga SlamDunk! and that's not something new to Jay Chou, who made his movie debut playing a character from another wildly popular manga Initial D. Along the way, it was decided to incorporate some kung fu into the movie, so hence the title, even if the idea wasn't very original, with Stephen Chow's Shaolin Soccer coming to mind with martial arts and ball games combined.<br /><br />However, and thankfully, those scenes where kung fu actually influenced the games were kept to a bare minimum, and in Kung Fu Dunk, really quite unnecessary, because they don't add much to the plot nor drum up much excitement, and at most offered some cheap laughs and reminisced about the time when Stephen Chow used kung fu in football games. Jay Chou is comfortable in his role as a martial artist Fang Shi-jie since it's not the first time he fought using martial arts (Curse of the Golden Flower anyone?), and under the stunt direc"
676,-1.1218030452728271,"In all my 60 years of age, I have learned that when we watch a movie there is an identification (whether we want it or not) implicit with an specific character.<br /><br />Sometimes because the character executes certain gesture, sometimes because the character speaks determinate word, or sentence  that we use or that we would like to use  in determinate situation.<br /><br />The movie in question, should be seen by this point of view. Who now find a parking space  in a mall,downtown, or in the street - taken by a car whose driver can't remember to think that he is not the only driver in the world?<br /><br />Who hasn't the urge to ""rubber out"" the ill mannered spat?<br /><br />Haven said that I ask: - Did you identify with DELLA (played by Kim Bassinger)? If your answer is: YES!, then try not to find absurd details  comparatively with life's reality  in the movie, because you'll certainly find the movie ridiculous.<br /><br />Abstractions made, you will see that the movie has mom"
677,-0.3944942057132721,"Pecker is another mainstream film by John Waters done on a smaller than Serial Mom. The title character of Pecker has a hobby of taking pictures of anything he sees. It doesn't matter if it's dirty or shocking when he takes pictures. He soon uses the pictures he taken and puts them on display at his work. Pecker live in a semi-normal middle-class family. His dad works at a drinking bar with a claw machine, but doesn't make enough money with a lesbian stripper bar across the street. His mom runs a thrift shop and loves to dress-up poor people. His older sister, Tina, works at a gay bar where her specialty is trade. His younger, Little Chrissy, has a habit of eating sugar, sugar, and nothing but sugary food. His grandmother, Memama, has a small statue of the Virgin Mary and plays ventriloquist with it. He also has 2 friends. On of his friends, Matt is a chronic shoplifter and his girlfriend, Shelley, runs a laundry mat as if she was a dictator. Soon, a tourist from New York buys his pict"
678,-0.4533465504646301,"Not sure one can call this an anti-war film, it shows war at an elite level. These are elite troops that know what they are doing and take great pride in it. Even when they are pacifist, they still enjoy the skill level and defeating their foes, even if it does go against being a pacifist. The movies is slow and rather uneventful and in many ways is rather tame as war movies go-more so by todays standards, no body parts flying off as in modern movies. It is brutal in other ways though as you see killing at a personal level. This is more of a thinking man's movie. Once you start to watch you don't want to miss anything. The thoughts of the men in the movie and their interactions, is what the movie is about- not the combat itself or a big exciting storyline. This maybe called a war triller.<br /><br />If you are into the skill of war, if you are into reading or seeing programs about the SAS and so on, YOU WANT TO WATCH THIS MOVIE!!!!!<br /><br />Comparable movies are The Hill (1965) with"
679,-1.986718773841858,"This place in England during 1940. Three orphans (Carrie, Charles and Paul) are sent to live with Miss Price (Angela Lansbury). She doesn't want them but reluctantly takes them in. It seems she is studying to be a witch through a correspondence course with the College of Witchcraft. (OK--I realize this is a family film but--College of Witchcraft??? Come ON!!) Before she can finish the course though the college is closed because of the war (???) and she seeks down the head Professor Browne (David Tomlinson). And her and the kids travel around on a bed with the help of a magical bedknob.<br /><br />I first saw this when I was 9 and vaguely remember loving it. It sure doesn't hold up as an adult! The story is silly (even for a fantasy), the kids are terrible actors and one of them (Charles) is incredibly obnoxious. Also Roddy McDowall is third billed and only appears in two short scenes! There's also a trip to the Isle of Naboombu which is run by animated animals. I thought that might be "
680,-0.8340599536895752,"I heard about this movie when watching VH1's ""100 Most Metal Moments."" On the segment, Gene Simmons (who played a cameo) and several other interviewees discussed how utterly awful this movie is. Unlike most people, I'm often more curious about checking out movies that have reputations for being ridiculously bad than, say, a masterpiece of cinema. The advantage of having that sort of attitude is half the time I find out that the movies are nowhere near as bad as people said, and I end up enjoying them a lot more than I initially expected. That was my experience with ""Trick or Treat."" Now, it's hard to make a movie about a teenage boy who receives messages from a dead heavy metal star by playing one of his vintage records backwards without people scoffing at the premise. Sure, it's certainly a strange premise, but one that's never been done before! Give the filmmakers points for originality for Pete's sake! If you're looking to buy the DVD, having no prior knowledge of the movie, don't b"
681,-1.3292421102523804,"I was not expecting the powerful filmmaking experience of ""Girlfight"". It's an Indie; low-budget, no big-name actors, freshman director. I had heard it was good, but not this good.<br /><br />Placed in a contemporary, ethnic, working-class Brooklyn, Karyn Kusama has done an extraordinary job of capturing the day-do-day struggles of urban Latinos. Diana, the protagonist, is seething with anger and lashes out at her high school peers, getting in trouble with the school and her friends. She is being raised by her single father, who appears to love her and her brother, but applies a strict, sex-based double standard on his children. The father's double standard is illustrated by the fact that Tiny, the brother, is taking boxing lessons at the local gym, but Diana is denied similar pursuits. On an errand to the gym to meet Tiny, Diana is captivated by boxing. Tiny doesn't like boxing, so he and Diana trade places; he gets the money from Dad then gives it to Diana to take the lessons in his "
682,-2.27940034866333,"Manhattan apartment dwellers have to put up with all kinds of inconveniences. The worst one is the lack of closet space! Some people who eat out all the time use their ranges and dishwashers as storage places because the closets are already full!<br /><br />Melvin Frank and Norman Panama, a great comedy writing team from that era, saw the potential in Eric Hodgins novel, whose hero, Jim Blandings, can't stand the cramped apartment where he and his wife Muriel, and two daughters, must share.<br /><br />Jim Blandings, a Madison Ave. executive, has had it! When he sees an ad for Connecticut living, he decides to take a look. Obviously, a first time owner, Jim is duped by the real estate man into buying the dilapidated house he is taken to inspect by an unscrupulous agent. This is only the beginning of his problems.<br /><br />Whatever could be wrong, goes wrong. The architect is asked to come out with a plan that doesn't work for the new house, after the original one is razed. As one prob"
683,-1.5032445192337036,"The film was shot at Movie Flats, just off route 395, near Lone Pine, California, north of the road to Whitney Portals. You can still find splashes of cement and iron joists plastered across the rocks where the sets were built. And you'll recognize the area from any Randolph Scott movie.<br /><br />I won't bother with the plot, since I'm sure it's covered elsewhere. The movie stars three athletes -- Fairbanks fils, who must have learned a good deal from his Dad -- Grant, an acrobat in his youth -- and MacLaughlin, a professional boxer from South Africa. Their physical skills are all on display.<br /><br />Not a moment of this movie is to be taken seriously. It's about Thugees, a sect in India, whence our English word ""thug."" I can't go through all the felicities of this movie but probably ought to point out that the director, George Stevens, was a polymath with a background in Laurel and Hardy movies -- see his choreography of the fight scenes -- and went on to the infinitely long diss"
684,-1.055837631225586,"Once in a while, you come upon a movie that defines your values and shows you the true depth of human emotions leaving you drained. Vivah is just that  maybe more. After watching DDLJ, Saajan, and Lamhey, I really thought that Bollywood has reached its pinnacle and will never come up with anything like that - EVER. Boy was I wrong! I went to the store to buy some groceries and decided to pick this movie up along with the new ""DON"" (just so I can compare The Great AB with ShahRukh  although the decision is already made in my mind). After debating whether I should waste almost 3 hours on a meaningless movie I decided to watch it realizing I had nothing else to do. When I saw the rating of U instead of an A, I was happy that at least it is something where I don't have to watch scantily clad women with bad acting skills doing nothing but dancing on every opportunity they get and making out with every guy to show that they have more skills in bed than a Hollywood B actress. For the first "
685,-0.11219321936368942,"I am decidedly not in the target audience for this film. I am a man nearly 50 who has only recently stumbled across the world of independent film. This happened quite by accident, with the discovery of a movie called Clerks late one night on television. The first two things I noticed about that film were that it was 1) technically amateurish and 2) brilliantly written. When I read an interview with the director in the local paper and he said that one of his influences was Clerks, I started to get interesting. When he said his main influence was The Station Agent, a movie I'd seen on DVD a week prior, I decided I had to go and check it out. The result could be described along the same lines as Clerks, although the two films are nothing alike content wise. Both films suffer from technical gaffes that are overcome through amazing writing. Whereas Clerks is a day in the life of a man who has nothing in his life at all and is afraid to ask tough questions about himself and his situation, Le"
686,-2.506401538848877,"Just two comments....SEVEN years apart? Hardly evidence of the film's relentless pulling-power! As has been mentioned, the low-budget telemovie status of 13 GANTRY ROW is a mitigating factor in its limited appeal. Having said that however the thing is not without merit - either as entertainment or as a fright outing per se.<br /><br />True, the plot at its most basic is a re-working of THE AMITYVILLE HORROR - only without much horror. More a case of intrigue! Gibney might have made a more worthwhile impression if she had played Halifax -investigating a couple of seemingly unconnected murders with the ""house"" as the main suspect. The script is better than average and the production overall of a high standard. It just fails to engage the viewer particularly at key moments.<br /><br />Having picked the DVD up for a mere $3.95 last week at my regular video store, I cannot begrudge the expenditure. $10.95 would be an acceptable price for the film. Just don't expect fireworks!"
687,-0.05758483707904816,"Neither the total disaster the UK critics claimed nor the misunderstood masterpiece its few fanboys insist, Revolver is at the very least an admirable attempt by Guy Ritchie to add a little substance to his conman capers. But then, nothing is more despised than an ambitious film that bites off more than it can chew, especially one using the gangster/con-artist movie framework. As might be expected from Luc Besson's name on the credits as producer, there's a definite element of 'Cinema de look' about it: set in a kind of realistic fantasy world where America and Britain overlap, it looks great, has a couple of superbly edited and conceived action sequences and oozes style, all of which mark it up as a disposable entertainment. But Ritchie clearly wants to do more than simply rehash his own movies for a fast buck, and he's spent a lot of time thinking and reading about life, the universe and everything. If anything its problem is that he's trying to throw in too many influences (a bit of"
688,-0.11219321936368942,"I am decidedly not in the target audience for this film. I am a man nearly 50 who has only recently stumbled across the world of independent film. This happened quite by accident, with the discovery of a movie called Clerks late one night on television. The first two things I noticed about that film were that it was 1) technically amateurish and 2) brilliantly written. When I read an interview with the director in the local paper and he said that one of his influences was Clerks, I started to get interesting. When he said his main influence was The Station Agent, a movie I'd seen on DVD a week prior, I decided I had to go and check it out. The result could be described along the same lines as Clerks, although the two films are nothing alike content wise. Both films suffer from technical gaffes that are overcome through amazing writing. Whereas Clerks is a day in the life of a man who has nothing in his life at all and is afraid to ask tough questions about himself and his situation, Le"
689,-2.2529561519622803,"It's not easy making a movie with 18 different stories in it. Although 18 different international directors took the challenge, not everyone of them is good, some of them even boring. But in his entity, ""Paris, je t'aime"" is breathtaking, showing that, as ""Love Actually"" put it, 'love is all around', especially in the city of love. Here's a resumé (I'll try to make at as spoiler-free as possible) of the 18 different stories.<br /><br />MONTMARTRE - kind of a dull opening sequence, nothing really special about it. A man finds a parking spot, and sees a lot of odd couples walking by, wondering why he can't find a girl. And than, suddenly, a woman faints next to his car...<br /><br />QUAIS DE SEINE - another dull sequence, about three teenage boys who are searching for some 'piece of ass', when suddenly a Muslim girl trips right in front of them, receiving help from one of the boys. Really basic, but with a sweet heart to it.<br /><br />LES MARAIS - this was a huge disappointment! Althoug"
690,-2.253843069076538,"Contains spoilers<br /><br />""Hollow Man"" is probably the weakest movie that Paul Verhoeven, director of great movies like ""Total Recall"", ""Starship Troopers"" and ""Robocop"" has ever made. <br /><br />That's probably not his fault. For some reason, Verhoeven got stuck with an utterly mediocre script, and he made the best of it. <br /><br />The first part of this movie is rather good, with lots of cynical jokes, great special effects and even Skunk Anansie on the soundtrack. Unfortunately, the movie falls flat in the second part, were it degenerates into a standard slasher movie or maybe a very bad ""Alien"" clone. The ending is especially ridiculous <SPOILER>, as Kevin Bacon keeps coming back to life after a number of incidents that should (in the logical sense of the word) have killed him. </SPOILER>. And the entire thing is quite shallow, indeed: the subject of becoming invisible is never fully investigated.<br /><br />But all in all, Verhoeven manages to stay well above average with th"
691,-0.13683171570301056,"A small pleasure in life is walking down the old movies aisle at the rental store, and picking stuff just because I haven't seen it. A large pleasure is occasionally taking that movie home and finding a small treasure like this playing on my screen.<br /><br />Long before Elia Kazan turned himself into a brand cranking out only notable movies (not good ones), he made this better than average drama. Watching it you begin to notice how many decent, good or nicely observed scenes have accumulated. Contrast that with his later films where the drama is writ large... preferably large, and unsubtle, and scandalous. Kazan was eventually more of a calculating promoter than a director. (um. No thanks) <br /><br />His future excesses are hinted at here only in the plot. The plague is coming! But here's an atypical Richard Widmark playing a family man in 1951 and avoiding most of the excesses of that trope; here's an almost watchable Barabra bel Geddes, with her bathos turned way down (well, for h"
