,score,review
428,-1.206756591796875,"The humor implicit in the complete title proverb derives from the Sunday School dictum that one would be better advised to prepare before you're dead for the Devil's scrutiny, i.e. so the Devil doesn't care when you're dead. There's no percentage in trying to Beat the Devil. The characters apparently didn't pay attention at Sunday School, and find themselves forced into crisis management, having eschewed crisis avoidance. But even a seasoned CEO would have difficulty managing these crises. Throwing dice is far more unpredictable than flipping a coin; when people are involved, the list of possible outcomes becomes even longer than the long list of unforgettable Sidney Lumet films. Until now, Hawke may not have been an unforgettable actor but here perhaps had an eye toward earning billing among other Lumet All Stars like Steiger and Pacino."
429,-0.7293246388435364,"Every time this film is on the BBC somebody in the Radio Times says how it is a satire against the post war world of rationing and the welfare state. I do not think this is the point of the film at all. The film parodies the spivs(small time criminals who ran the blackmarket) and the housewives league who campaigned against government restrictions but were really a Tory front organisation.<br /><br />Yes of course the film sends up the political/social situation but in the end the people realise that they need all the controls to ensure a fair society,they want to be British and muddle through rather than foreign.<br /><br />But I don't think they go back to being exactly like they were before."
430,-0.5272117257118225,"Expecting to see another Nunsploitation movie with a mean Mother Superior abusing and torturing her charges, Flavia turned out to be MUCH more than I had anticipated.<br /><br />It actually has a feminist storyline, though I don't think such a term existed in the era in which the movie is set. It certainly wasn't practiced. Women (and the Jews and the poor) are very downtrodden and locked into menial spots in society. Throughout the story, Sister Flavia (Florinda Bolkan) witnesses the tyranny of her time until she just can't sit there any longer and actually does something about it, albeit with disastrous results.<br /><br />The pre-credit sequence has Flavia as a young adolescent near a battlefield. She sees an injured ""evil"" Muslim soldier (one of the few still alive) and tries to assist him. Before she can, her hate-filled father beheads the soldier and waves his head in her face (great family dynamics, huh?). After this, her father forces her to join a convent where she witnesses e"
431,-0.7744542360305786,"I agree with ""Jerry."" It's a very underrated space movie (of course, how many good low-budget ones AREN'T underrated?) If I remember correctly, the solution to the mystery was a sort of variation (but not ""rip-off"") of 2001, because the computer controlling the spaceship had actually been a man, who had somehow been turned into a computer. And like HAL, they tried to disconnect his ""mind"", but not the mechanical parts of him, and as with HAL, it led to disaster. There is at least one funny moment. When the Christopher Cary character, who can't find any food, finds the abandoned pet bird, there's a kind of ominous moment, but then the obvious thing doesn't happen after all."
432,-1.3785089254379272,"A fey story of a Martian attempt to colonize Earth. (Things must be pretty bad back on Mars.) Two state troopers investigate the scene of a reported UFO crash. Whatever landed is buried under the ice at Tracy's Pond but there are footsteps in the snow leading to a nearby diner.<br /><br />The diner has had no customers since eleven o'clock that morning. Now there are a handful of bus passengers sitting around waiting for permission to cross a structurally weak bridge. The bus driver insists that six passengers were aboard the bus, although he didn't notice who they were. The problem is that there are now SEVEN people waiting for the journey to be resumed. One of them is an alien, but which one? All of them are suspect. There's the crazy old man (Jack Elam), of course, who seems to exercise a sub rosa wit. There's a blustering businessman who must get to Boston (John Hoyt). A young couple on their honeymoon. (Execrable performance by the husband, Ron Kipling.) Except for the couples, no"
433,-0.03192916512489319,"I'm sure that not many people outside of Australia have ever heard of the legend of Ned Kelly. I once saw a documentary about the man, but that's the only time I once saw or heard anything about him. And I guess that this might be the biggest problem this movie will have to face. No-one knows anything about it and probably not many people will care about the subject.<br /><br />The movie tells the story of Ned Kelly's life. The Irish immigrant has lived in north-west Victoria all his life, but has never been very welcome by the authorities. The police always accuses him of everything they can think of and they keep harassing his family. When Kelly is fed up with the way everything goes, he forms a gang with his brother and two other men. They start robbing banks and even hijack an entire town for 3 days. All this violence leads to a man hunt organized by the police and when they kill three policemen, they are outlawed. Finally they take over a pub in Glenrowan, where they have a party "
434,-0.766441285610199,"This is why I still have nightmares.<br /><br />This terrifying film (a musical) was considered appropriate for children in the 1970s.<br /><br />A boy leaves on a magical journey to an island. The mayor of the island, Pufnstuf, allegedly a dragon, looking more like a newt with conjunctivitis to me, and a magic talking flute are targeted by a witch (Billie Halliday, who was considered 'a bit of alright' at the time).<br /><br />The flute is recovered at an 'interesting' witches convention, with the witches having a gay old time. The boy dresses in drag then as a 'fairy' to recover the flute.<br /><br />Not suitable for children."
435,-1.8311232328414917,"Was this based on a comic-book? A video-game? A drawing by a 3 year-old? <br /><br />There is nothing in this movie to be taken seriously at all; not the characters, not the dialog, not the plot, not the action. Nothing. We have high-tech international terrorists/criminals who bicker like pre-school kids, Stallone's man-of-steel-type resilience towards ice-cold weather, dialog so dumb that it's sometimes almost hilarious, and so on. Even the codename that the bad guys use is dumb (""tango-tango""). A film that entertains through some suspense, good action-sequences, and a nice snowy mountainous setting. Oh, yes: and the unintentional humour.<br /><br />The film opens with some truly bad and unconvincing gay banter between our go-lucky and happy characters who are obviously having a ""swell"" time. Then comes a sweat-inducing failed-rescue part, which should make anyone with fear-of-heights problems want to pull their hair out. And then we have some more bad dialog, and after that some more"
436,-0.37094011902809143,"When the Chamberlain family is camping near Ayers Rock, Australia, Lindy Chamberlain (Meryl Streep) sees her baby being dragged out of their tent by a dingo and then begins an ordeal that no one should have to experience. For it seems like the dingo story is not believed by the public or the press, and the whole thing turns into a circus. Lindy doesn't help matters either because she won't play to the jury or courtroom, she's only herself, and she's a tough nut to crack, so of course everyone thinks she's guilty because there's a piece of evidence that hasn't come to light. Sam Neill is excellent as Michael Chamberlain, a Seventh-Day adventist pastor, who has doubts about his faith and perhaps about his wife. It's good (or bad) to see that people are just as prejudiced and stupid elsewhere as they are in the States too, because the Australian public doesn't believe the story and the media only fans the flames. Eventually, Lindy is found guilty and sent to prison for a life of hard labo"
437,-0.693206787109375,"When I heard Patrick Swayze was finally returning to his acting career with KING SOLOMON'S MINES I was very excited. I was expecting a great Indiana Jones type action adventure. What I got was a 4 hour long (with commercials) epic that was very slow. The second and third hour could have been dropped altogether and the story would not have suffered for it. The ending was good (no spoilers here)but I was still left wanting more. Well all a guy can do is prey that Swayze does ""RoadHouse 2"" so he can get back into the action genre that made him famous. Until than if your a fan of King Solomon's Mines than read the book or watch the 1985 version with Richard Chamberlain and Sharon Stone which is also not very good but its only and hour and forty minutes of your life gone instead of 4 hours."
438,-1.6125967502593994,"I first heard of this movie after purchasing the 1976 flick ""Snuff"". I was told that Devil's Experiment was much better so naturally I went ahead and ordered the Guinea Pig box set. I was really interested to hear that Charlie Sheen had come out trying to ban either this movie or the second one, so my interest was peaked.<br /><br />Devil's Experiment is a short film with no story, no character development. Just 3 men torturing a woman for about 45 minutes. They torture her in various ways like beating her, spinning her in circles over and over again then forcing her to drink alcohol, forcing her to listen to hi-pitched noise for 24 hours, smash her hand with a mallet, burning and putting maggots on the burns, throwing guts at her, and ultimately shoving a sharp needle through her eye.<br /><br />I must say that a lot of this movie was fake, like the beating scenes. But then, some of it was actually well done as far as grossing you out. The scenes in which the woman is being spun aroun"
439,-0.37159210443496704,"The fourth of five westerns Anthony Mann did with James Stewart, this one involves a hard bitten cattleman named Jeff Webster who takes a cattle drive from Wyoming to Alaska, via Seattle. He hooks up in Seattle with his partners Ben Tatum (Walter Brennan) and Rube Morris (Jay C. Flippen) that he has sent ahead of time in order to make preparations for the boat trip, north.<br /><br />But first, he has to put up with insubordinate trail hands, cheating riverboat captains and the charms of coy, manipulative Ronda Castle (Ruth Roman) who believes Jeff could be a valuable ally in the future. That's why she hides him out on the boat while the captain's looking for him for the earlier (and justifiable) killing of a trail hand.<br /><br />Jeff also has the misfortune of running into sleazy Judge Gannon (John McIntire) who runs the town of Skagway, Alaska. Gannon locks Jeff up for disrupting his public hanging by running his cattle through town. He fines Jeff the ownership of his cattle and Je"
440,-1.696791648864746,"It was on at 7:30am, too close to school to see very often. The animation & computer graphics were spectacular for the time. The idea of cowboys & ordinary people casually throwing around space vehicles & robots was amazing. Maybe it inspired Treasure Planet.<br /><br />Unfortunately, it's really boring in the DVD format. The shows are all basically identical. When viewing non-sequential episodes on a DVD, you're stoned by disk #3. By today's standards, the animation is spotty. We don't notice the computer graphics anymore and focus on how corny the characters are instead.<br /><br />The bright spots are the heroine characters. They were a lot more believable, took themselves more seriously than modern heroines, and weren't corny. They actually saved men."
441,-0.3113715946674347,"I just saw this film last night at Toronto Film Festival where it was playing under the Midnight Madness section. To tell you the truth, the only reason why I went for this movie was because it shared its name with the Radiohead song, and also because my friend had bought the tickets so I really didn't have a choice :-D I went in expecting it to be something like The Silence of the Lambs, but it turned out to be semi-gore flick. Somebody has already mentioned that none of the characters are likable, and that is absolutely correct. I really couldn't care less if Potente's character got her entrails ripped out by the Creep. I was rooting for the homeless to make it out alive with Potente's character getting her just desserts. Christopher Smith has certainly done a great job with the visual aspect of the film. However, the story is rather weak, but then again the whole point of the movie was to scare the crap out of you and it did that quite effectively. The score by a Bristol band called"
442,-1.6791102886199951,"The photography of this bid-budget production is surprisingly bad. Colors are muddy and brownish and the photography has very 80ish look to it. Direction and editing are often quite uninspired and TV-movie like, too. *And* at first the movie only seems to want to torture its viewers with lurid images of sex and violence. Hans Zimmer's score is also a typically simple and bland work of this overrated, untalented composer.<br /><br />But if you are willing to watch the movie further you are rewarded with a very moving family story, a sort of European version of Edna Ferber's family epos Giant. While at first you wonder why Clara married this idiotic man, even his character gets more depth and more background one can judge him by. Clara delivers the movie's spiritual lesson, a great and moving statement set against the terrible happenings in her country. Her daughter, whose lover is a young Antonio Banderas at the beginning of his international career, understands that lesson and ultimate"
443,-1.7664873600006104,"The tweedy professor-types thought they had it all figured out. Today's peoples who inhabit Polynesia descended from migratory Asians, intrepidly moving from the Far East, island to island, eastward into Tahiti and all the other exotic tropic isles of the South Pacific over thousands of years. But the established thinking just didn't sit well with young Norwegian ethnographer Thor Heyerdahl. If that explanation were true, how come some folks born and bred in those islands have traditions, artwork, and physical features resembling not those from Asia, but South America? How can the vegetation of Ecuador, Peru and Chile look so much like what you'd find on the island several thousand miles away? Is it just a coincidence that the Islanders point out to sea in the direction of South America and say that is where their ancestors came from, led by Tiki, their equivalent of Adam? Meanwhile, how is it Norwegians speak of Scandanavian forerunners who were chased from the South American continen"
444,-1.907311201095581,"The DVD for ""Danaza Macabra"" (Castle of Blood) is very odd. That's because parts of the film are in French with subtitles and the rest is dubbed into English from the French. Sometimes, characters switched between the two in the middle of a scene! When I tried to get the film to be JUST subtitled or just dubbed, it made no difference! Odd, but still watchable.<br /><br />The story purports to be based on a Poe story, though I can't recall which one. In fact, the character of Poe appears in the beginning and end of the film--though it didn't look especially like him.<br /><br />A rich man makes a bet with a guy down on his luck that he cannot stay the entire night in a manner home. It seems like an easy bet to win--even if the house is very creepy. However, it can't be that easy, as the rich guy says that all those who previously took the bet died--yet this fool STILL wants to make the wager! While in the home, he meets lovely Barbara Steele within and falls madly for her. Later, howeve"
445,-0.4379105865955353,"I just saw this movie at a sneak preview and all I can say is...""What did I just watch????"" And I mean that in a good and bad way.<br /><br />The plot is really simple. Stiller and Black play friends/neighbors. Stiller is the focused, hardworker while Black is a dreamer. Black invents this idea to create a spray that erases poo. The idea becomes very popular, and Black becomes very rich. The extravagant lifestyle that Black gains and the fact that he still tries to be best friends with Stiller causes Stiller to become crazy with envy.<br /><br />As I said, the plot is simple. Everything else is plain odd. The direction is odd, with a weird rotating opening shot to out-of-nowhere sped up sequences. The dialouge and the acting is very odd; odd in a rambling sort of way. And the sound track is the oddest thing in the movie, from the weird ""Envy"" song that keeps on reappearing to the scene where you think you're going to hear a classic 80's song but suddenly it's in Japanese.<br /><br />So"
446,-1.305775761604309,"This movie is without a doubt a perfect 10/10.. for all you people out there who are rating this film low grades because it has no ""good plot"" or anything like that, thats ridiculous, saying that a Jackie Chan movie is bad because of its plot is like saying a porn movie is bad because it has no plot! you watch Jackie Chan FOR THE FIGHT SCENES, for the action its not so much concentrated on a good story or anything like that, if you look at how he makes movies and compare it to other American films from that era and even later you will realize that Jackie Chan's movies had over the top fights scenes and not really good plots while American movies had good plots but shitty action scenes compared to what Jackie Chan was doing at the time. Porn is watched for the porn, Jackie Chan is watched for the ACTION, i think you people are rating it bad because there's no plot because you think thats how a smart movie critic would rate a good movie but the way i see it is a good movie is a movie tha"
447,-2.504549980163574,"Over the years, we've seen a lot of preposterous things done by writers when the show just had to go on no matter what, keeping ""8 Simple Rules"" going after John Ritter died comes to mind, but this is probably the first time I cared. The idea of having ""That 70's Show"" without Eric or to a lesser extent Kelso is ridiculous. They tried to cover it up with a comeback of Leo and increasingly outrageous story lines, but it always felt like why bother when you don't have a main character anymore. It just didn't really connect, it was a bunch of unrelated stuff happening that most of the time wasn't even funny. The last season felt like the season too much for every single character, simply because Eric used to take a lot of screen time and now we'd be smashed in the face by how stale and repetitive the rest of the characters were. Focusing on the gimmick that is Fez was thoroughly uninteresting and the character would simply stop working, because the whole deal was that he'd say something w"
448,-1.221825361251831,"I love this movie, but the music at all the alumni gatherings is just stupid.<br /><br />The fateful game took place in 1972. That means that the protagonists graduated in 1972. But almost all of the music played at the dances etc. is from the 1950s and very early 1960s.<br /><br />Having just attended my 30th high school reunion, I can assure you that the last music to be played at a reunion or dance of former high school people is their parents' music.<br /><br />I understand the difficulty of finding relevant 1970s music -- we all know what a desolate time it was musically. But it wasn't completely bereft, and the producers of the film should have taken more care. I found those dance scenes very jarring to my otherwise willing suspension of disbelief in the rest of the film.<br /><br />This was a bad director and/or producer decision."
449,-1.0850874185562134,"This movie is banned in just about every foreign country I can think of. The Japanese people (?) who star in this must have been really desperate for a job, or we're just friends. Here's the scoop:<br /><br />Three thugs torture the hell out of a helpless woman, they use all kinds of things to eventually kill her, they burn her, kick her, spin here around in a chair (over 200 times!), they use sound torture (by forcing her to listen to a static sound for over 20 hours! It don't sound that bad at all, but it CAN make you go nuts). They throw guts (probably from an animal) at her while shes knocked out, and she freaks when she wakes up. And who can forget the grande finale the GREATEST EYEBALL TORTURE I HAVE EVER SEEN!<br /><br />If you have not heard of these films, and watch one without knowing that it is a simulated snuff film, you will think it is! (just ask Charlie Sheen) This is guaranteed to freak people out and make some sick! Like I said pure underground. Check it out if you are"
450,-0.181437149643898,"Metro-Goldwyn-Mayer is a very lost player in the short cartoon market. This market is essentially dominated by the Looney Tunes and the Merry Melodies shorts, coming from Warner Bros. But MGM is also able of releasing hidden gems, like ""To Spring"", an astonishing story about the most beautiful season of the year.<br /><br />In the environment depicted here, spring isn't caused by natural cycles, but is fabricated. And by who? By little male elves who live below ground. Each spring, when the snow begins to melt, they start working. They begin by felling rainbow rock columns, then reducing them to rubble and using this rubble to turn it into color fluids, which will be moved up to the ground and bearing grass, flowers... In other words, spring! The first half of the cartoon depicts spring's fabrication, but the second part is a little bit different. Old Man Winter comes back and he tries to extend winter by destroying the elves' work. So from this point, we assist to a battle between the"
451,-0.6272633671760559,"This 1934 adaptation of Somerset Maugham's novel put Bette Davis on the map as a movie actress. She might have won an Academy Award for her performance but the films was made on loan, so her studio didn't push for her. Her acting in this one doesn't come off well by today's standards. As the heartless waitress who jerks Philip, a sensitive medical student, around and nearly ruins his life, Davis is way too shrill, almost demonic. Director John Cromwell, who usually elicited good performances from his actresses, was perhaps overwhelmed by this one. Davis is watchable, for sure, but so strident and predatory as to seem scarcely human. I imagine the character of Millie as quieter, less feminine than Davis, with maybe a touch of the tomboy. Davis is such a strong, immediate presence that's there's no air of mystery to her, which makes Philip's attraction to her seem more overtly masochistic than it should be.<br /><br />As Philip, Leslie Howard is excellent. His wan, somewhat wilted good l"
452,-0.19134998321533203,"In the early to mid 1970's, Clifford Irving proposed to write the ultimate biography of Howard Hughes,claiming to have spent months preparing for the book,engaged in interviews with the reclusive millionaire. When all of this turned out to be false,Irving was accused of perjury & spent several years behind bars (although always admitting his findings were accurate). Flash forward to 20001,several months prior to September 11th, a book,entitled 'Forbidden Love' (published in the U.S. as 'Honor Lost:Love And Death In Modern Day Jordan') by a previously unknown author by the name of Norma Khouri,a woman from Jordan,who reported on the death by mercy killing of her best friend Dalia,due to the fact that Dalia,being from a devout Muslim background,was dating a Christian man. It,like Irving's biography on Hughes was revealed as a potential hoax. Australian film maker,Anna Broinowski attempts to delve into the quagmire that was Khouri's attempts to clear herself of the lie(s). Over the time f"
453,-1.0350267887115479,"There is a bit of trivia which should be pointed out about a scene early in the movie where Homer watches the attempt of December 6, 1957 (at least that was the video used on the TV he was watching) which showed the Vangard launch attempt, which failed.<br /><br />He is next shown reading or dictating a letter to Dr. Von Braun offering condolences about the failure.<br /><br />Von Braun was at Marshall space flight center in Huntsville working for the Army. The Vanguard project was by the early Nasa team which was at what soon became Goddard Space flight center.<br /><br />The army rushed the Jupiter-C, which was essentially a US made V2 technology, but worked to launch a satellite in response to Russia's success with Sputnik.<br /><br />This error may have actually been made by Homer, because of the notoriety of Von Braun, but his team didn't have their attempt fail. In fact the underlying Redstone was flying from 52 and was the first US man rated booster, used for Shepard's sub orbit"
